# 🎙️ Atomic Workshop Paid Registrations (2026)

Dit document bevat UITSLUITEND de betaalde inschrijvingen (orders) voor de Studio-tak. Geen leads.

---

## 📋 Betaalde Inschrijvingen

| Order ID | Datum | Deelnemer | Email | Workshop | Prijs | Meta Data |
| :--- | :--- | :--- | :--- | :--- | :--- | :--- |
| 6829 | 4/2/2026 | Gast | - | Voice-overs voor beginners | €0.00 | `{"migration_source":"ID348299_voices.sql","participant_info":{"email":"peter.ke@hotmail.com","lastName":"Kerschot","firstName":"Peter"},"workshop_schedule":{"time":"","end_date":"2026-02-27T17:00:00Z","raw_date":"27 februari 2026 van 10u00 tot 17u00","start_date":"2026-02-27T10:00:00Z"}}` |
| 6829 | 4/2/2026 | Gast | - | Voice-overs voor beginners | €0.00 | `{"migration_source":"ID348299_voices.sql","participant_info":{"email":"peter.ke@hotmail.com","lastName":"Kerschot","firstName":"Peter"},"workshop_schedule":{"time":"","end_date":"2026-02-27T17:00:00Z","raw_date":"27 februari 2026 van 10u00 tot 17u00","start_date":"2026-02-27T10:00:00Z"}}` |
| 6829 | 4/2/2026 | Gast | - | Voice-overs voor beginners | €0.00 | `{"migration_source":"ID348299_voices.sql","participant_info":{"email":"peter.ke@hotmail.com","userId":8728,"lastName":"Kerschot","firstName":"Peter"},"workshop_schedule":{"time":"","end_date":"2026-02-27T17:00:00Z","raw_date":"27 februari 2026 van 10u00 tot 17u00","start_date":"2026-02-27T10:00:00Z"}}` |
| 6829 | 4/2/2026 | Gast | - | Voice-overs voor beginners | €499.00 | `{"migration_source":"ID348299_voices.sql","participant_info":{"age":"","email":"peter.ke@hotmail.com","userId":8728,"lastName":"Kerschot","firstName":"Peter","experience":"","profession":""},"workshop_schedule":{"time":"","raw_date":"27 februari 2026 van 10u00 tot 17u00","clean_date":"2026-02-27T10:00:00Z"}}` |
| 6829 | 4/2/2026 | Gast | - | Voice-overs voor beginners | €0.00 | `{"migration_source":"ID348299_voices.sql","participant_info":{"email":"peter.ke@hotmail.com","lastName":"Kerschot","firstName":"Peter"},"workshop_schedule":{"time":"","end_date":"2026-02-27T17:00:00Z","raw_date":"27 februari 2026 van 10u00 tot 17u00","start_date":"2026-02-27T10:00:00Z"}}` |
| 6829 | 4/2/2026 | Gast | - | Voice-overs voor beginners | €0.00 | `{"migration_source":"ID348299_voices.sql","participant_info":{"email":"peter.ke@hotmail.com","lastName":"Kerschot","firstName":"Peter"},"workshop_schedule":{"time":"","end_date":"2026-02-27T17:00:00Z","raw_date":"27 februari 2026 van 10u00 tot 17u00","start_date":"2026-02-27T10:00:00Z"}}` |
| 6792 | 28/1/2026 | Gast | - | Voice-overs voor beginners | €499.00 | `{"migration_source":"ID348299_voices.sql","participant_info":{"age":"27","email":"evelyne.benbassat@hotmail.com","userId":11913,"lastName":"Benbassat","firstName":"Evelyne","experience":"","profession":"logopedist"},"workshop_schedule":{"time":"","end_date":"2026-02-27T17:00:00Z","raw_date":"27 februari 2026 van 10u00 tot 17u00","start_date":"2026-02-27T10:00:00Z"}}` |
| 6792 | 28/1/2026 | Gast | - | Voice-overs voor beginners | €0.00 | `{"migration_source":"ID348299_voices.sql","participant_info":{"email":"evelyne.benbassat@hotmail.com","lastName":"Benbassat","firstName":"Evelyne"},"workshop_schedule":{"time":"","end_date":"2026-02-27T17:00:00Z","raw_date":"27 februari 2026 van 10u00 tot 17u00","start_date":"2026-02-27T10:00:00Z"}}` |
| 6792 | 28/1/2026 | Gast | - | Voice-overs voor beginners | €0.00 | `{"migration_source":"ID348299_voices.sql","participant_info":{"email":"evelyne.benbassat@hotmail.com","lastName":"Benbassat","firstName":"Evelyne"},"workshop_schedule":{"time":"","end_date":"2026-02-27T17:00:00Z","raw_date":"27 februari 2026 van 10u00 tot 17u00","start_date":"2026-02-27T10:00:00Z"}}` |
| 6792 | 28/1/2026 | Gast | - | Voice-overs voor beginners | €0.00 | `{"migration_source":"ID348299_voices.sql","participant_info":{"email":"evelyne.benbassat@hotmail.com","lastName":"Benbassat","firstName":"Evelyne"},"workshop_schedule":{"time":"","end_date":"2026-02-27T17:00:00Z","raw_date":"27 februari 2026 van 10u00 tot 17u00","start_date":"2026-02-27T10:00:00Z"}}` |
| 6792 | 28/1/2026 | Gast | - | Voice-overs voor beginners | €0.00 | `{"migration_source":"ID348299_voices.sql","participant_info":{"email":"evelyne.benbassat@hotmail.com","lastName":"Benbassat","firstName":"Evelyne"},"workshop_schedule":{"time":"","end_date":"2026-02-27T17:00:00Z","raw_date":"27 februari 2026 van 10u00 tot 17u00","start_date":"2026-02-27T10:00:00Z"}}` |
| 6792 | 28/1/2026 | Gast | - | Voice-overs voor beginners | €0.00 | `{"migration_source":"ID348299_voices.sql","participant_info":{"email":"evelyne.benbassat@hotmail.com","userId":11913,"lastName":"Benbassat","firstName":"Evelyne"},"workshop_schedule":{"time":"","end_date":"2026-02-27T17:00:00Z","raw_date":"27 februari 2026 van 10u00 tot 17u00","start_date":"2026-02-27T10:00:00Z"}}` |
| 6791 | 28/1/2026 | Gast | - | Voice-overs voor beginners | €0.00 | `{"migration_source":"ID348299_voices.sql","participant_info":{"email":"espe.riekaert@gmail.com","lastName":"Riekaert","firstName":"Espe"},"workshop_schedule":{"time":"","end_date":"2026-02-27T17:00:00Z","raw_date":"27 februari 2026 van 10u00 tot 17u00","start_date":"2026-02-27T10:00:00Z"}}` |
| 6791 | 28/1/2026 | Gast | - | Voice-overs voor beginners | €0.00 | `{"migration_source":"ID348299_voices.sql","participant_info":{"email":"espe.riekaert@gmail.com","lastName":"Riekaert","firstName":"Espe"},"workshop_schedule":{"time":"","end_date":"2026-02-27T17:00:00Z","raw_date":"27 februari 2026 van 10u00 tot 17u00","start_date":"2026-02-27T10:00:00Z"}}` |
| 6791 | 28/1/2026 | Gast | - | Voice-overs voor beginners | €0.00 | `{"migration_source":"ID348299_voices.sql","participant_info":{"email":"espe.riekaert@gmail.com","lastName":"Riekaert","firstName":"Espe"},"workshop_schedule":{"time":"","end_date":"2026-02-27T17:00:00Z","raw_date":"27 februari 2026 van 10u00 tot 17u00","start_date":"2026-02-27T10:00:00Z"}}` |
| 6791 | 28/1/2026 | Gast | - | Voice-overs voor beginners | €0.00 | `{"migration_source":"ID348299_voices.sql","participant_info":{"email":"espe.riekaert@gmail.com","lastName":"Riekaert","firstName":"Espe"},"workshop_schedule":{"time":"","end_date":"2026-02-27T17:00:00Z","raw_date":"27 februari 2026 van 10u00 tot 17u00","start_date":"2026-02-27T10:00:00Z"}}` |
| 6791 | 28/1/2026 | Gast | - | Voice-overs voor beginners | €499.00 | `{"migration_source":"ID348299_voices.sql","participant_info":{"age":"38","email":"espe.riekaert@gmail.com","userId":10272,"lastName":"Riekaert","firstName":"Espe","experience":"","profession":"Content creator"},"workshop_schedule":{"time":"","end_date":"2026-02-27T17:00:00Z","raw_date":"27 februari 2026 van 10u00 tot 17u00","start_date":"2026-02-27T10:00:00Z"}}` |
| 6791 | 28/1/2026 | Gast | - | Voice-overs voor beginners | €0.00 | `{"migration_source":"ID348299_voices.sql","participant_info":{"email":"espe.riekaert@gmail.com","userId":10272,"lastName":"Riekaert","firstName":"Espe"},"workshop_schedule":{"time":"","end_date":"2026-02-27T17:00:00Z","raw_date":"27 februari 2026 van 10u00 tot 17u00","start_date":"2026-02-27T10:00:00Z"}}` |
| 6789 | 27/1/2026 | Gast | - | Voice-overs voor beginners | €0.00 | `{"migration_source":"ID348299_voices.sql","participant_info":{"email":"naomi.vanden.abeele@focus-wtv.be","lastName":"Vanden Abeele","firstName":"Naomi"},"workshop_schedule":{"time":"","end_date":"2026-02-27T17:00:00Z","raw_date":"27 februari 2026 van 10u00 tot 17u00","start_date":"2026-02-27T10:00:00Z"}}` |
| 6789 | 27/1/2026 | Gast | - | Voice-overs voor beginners | €0.00 | `{"migration_source":"ID348299_voices.sql","participant_info":{"email":"naomi.vanden.abeele@focus-wtv.be","lastName":"Vanden Abeele","firstName":"Naomi"},"workshop_schedule":{"time":"","end_date":"2026-02-27T17:00:00Z","raw_date":"27 februari 2026 van 10u00 tot 17u00","start_date":"2026-02-27T10:00:00Z"}}` |
| 6789 | 27/1/2026 | Gast | - | Voice-overs voor beginners | €0.00 | `{"migration_source":"ID348299_voices.sql","participant_info":{"email":"naomi.vanden.abeele@focus-wtv.be","lastName":"Vanden Abeele","firstName":"Naomi"},"workshop_schedule":{"time":"","end_date":"2026-02-27T17:00:00Z","raw_date":"27 februari 2026 van 10u00 tot 17u00","start_date":"2026-02-27T10:00:00Z"}}` |
| 6789 | 27/1/2026 | Gast | - | Voice-overs voor beginners | €0.00 | `{"migration_source":"ID348299_voices.sql","participant_info":{"email":"naomi.vanden.abeele@focus-wtv.be","lastName":"Vanden Abeele","firstName":"Naomi"},"workshop_schedule":{"time":"","end_date":"2026-02-27T17:00:00Z","raw_date":"27 februari 2026 van 10u00 tot 17u00","start_date":"2026-02-27T10:00:00Z"}}` |
| 6789 | 27/1/2026 | Gast | - | Voice-overs voor beginners | €0.00 | `{"migration_source":"ID348299_voices.sql","participant_info":{"email":"naomi.vanden.abeele@focus-wtv.be","userId":12176,"lastName":"Vanden Abeele","firstName":"Naomi"},"workshop_schedule":{"time":"","end_date":"2026-02-27T17:00:00Z","raw_date":"27 februari 2026 van 10u00 tot 17u00","start_date":"2026-02-27T10:00:00Z"}}` |
| 6789 | 27/1/2026 | Gast | - | Voice-overs voor beginners | €499.00 | `{"migration_source":"ID348299_voices.sql","participant_info":{"age":"28","email":"naomi.vanden.abeele@focus-wtv.be","userId":12176,"lastName":"Vanden Abeele","firstName":"Naomi","experience":"","profession":"Programmamaker"},"workshop_schedule":{"time":"","end_date":"2026-02-27T17:00:00Z","raw_date":"27 februari 2026 van 10u00 tot 17u00","start_date":"2026-02-27T10:00:00Z"}}` |
| 7 | 16/1/2026 | Johfrah Lefebvre | johfrahtest@voices.be | Maak je eigen podcast | €499.00 | `{"migration_source":"ID348299_voices.sql","participant_info":{"age":"33","email":"info@johfrah.be","userId":9600,"lastName":"Lefebvre","firstName":"Johfrah","experience":"","profession":"artistiek medewerker"},"workshop_schedule":{"time":"","end_date":"2026-02-06T17:00:00Z","raw_date":"6 februari 2026 van 10u00 tot 17u00","start_date":"2026-02-06T10:00:00Z"}}` |
| 6 | 15/1/2026 | Johfrah Lefebvre | test441@voices.be | Maak je eigen podcast | €499.00 | `{"migration_source":"ID348299_voices.sql","participant_info":{"age":"33","email":"test441@voices.be","userId":12716,"lastName":"Lefebvre","firstName":"Johfrah","experience":"","profession":"artistiek medewerker"},"workshop_schedule":{"time":"","end_date":"2026-02-06T17:00:00Z","raw_date":"6 februari 2026 van 10u00 tot 17u00","start_date":"2026-02-06T10:00:00Z"}}` |
| 5 | 15/1/2026 | Johfrah Lefebvre | test8@voices.be | Maak je eigen podcast | €499.00 | `{"migration_source":"ID348299_voices.sql","participant_info":{"age":"41","email":"test8@voices.be","userId":12715,"lastName":"Lefebvre","firstName":"Johfrah","experience":"","profession":"artistiek medewerker"},"workshop_schedule":{"time":"","end_date":"2026-02-06T17:00:00Z","raw_date":"6 februari 2026 van 10u00 tot 17u00","start_date":"2026-02-06T10:00:00Z"}}` |
| 4 | 15/1/2026 | Gast | eline@debatterie.be | Maak je eigen podcast | €0.00 | `{"migration_source":"ID348299_voices.sql","participant_info":{"age":"","email":"eline@debatterie.be","userId":12712,"lastName":"","firstName":"","experience":"","profession":""},"workshop_schedule":{"time":"","end_date":null,"raw_date":"","start_date":null}}` |
| 3 | 15/1/2026 | Gast | eline@debatterie.be | Maak je eigen podcast | €0.00 | `{"migration_source":"ID348299_voices.sql","participant_info":{"age":"","email":"eline@debatterie.be","userId":12712,"lastName":"Van Herreweghen","firstName":"Eline","experience":"","profession":""},"workshop_schedule":{"time":"","end_date":null,"raw_date":"","start_date":null}}` |
| 2 | 15/1/2026 | Gast | eline@debatterie.be | Delphine L | €157.45 | `"{\"script\":\"Merci de contacter le service clientèle de Zembro.\\nPour les questions non urgentes, nous vous prions de bien vouloir nous contacter du lundi au vendredi entre 9h et 17h. S’il s’agit d’une question urgente, veuillez laisser un message après le signal sonore en incluant votre numéro de contact. Un membre de notre équipe vous recontactera dès que possible.\\nMerci d’avance !\",\"usage\":\"\",\"instructions\":\"\",\"workshop_details\":{\"datum\":\"\",\"tijd\":\"\",\"leeftijd\":null,\"beroep\":\"\"}}"` |
| 2 | 15/1/2026 | Gast | eline@debatterie.be | Maak je eigen podcast | €0.00 | `{"migration_source":"ID348299_voices.sql","participant_info":{"age":"","email":"eline@debatterie.be","userId":12712,"lastName":"Van Herreweghen","firstName":"Eline","experience":"","profession":""},"workshop_schedule":{"time":"","end_date":null,"raw_date":"","start_date":null}}` |
| 6714 | 5/12/2025 | Gast | - | Voice-overs voor beginners | €0.00 | `{"migration_source":"ID348299_voices.sql","participant_info":{"age":"","email":"Petra.D\\'Hoker@lv.vlaanderen.be","userId":12148,"lastName":"D’Hoker","firstName":"Petra","experience":"","profession":"Communicatiemedewerker"},"workshop_schedule":{"time":"","raw_date":"9 december 2025 van 10u00 tot 17u00","clean_date":"2025-12-09T10:00:00Z"}}` |
| 6714 | 5/12/2025 | Gast | - | Voice-overs voor beginners | €0.00 | `{"migration_source":"ID348299_voices.sql","participant_info":{"email":"Petra.D\\'Hoker@lv.vlaanderen.be","userId":12148,"lastName":"D’Hoker","firstName":"Petra"},"workshop_schedule":{"time":"","end_date":"2025-12-09T17:00:00Z","raw_date":"9 december 2025 van 10u00 tot 17u00","start_date":"2025-12-09T10:00:00Z"}}` |
| 6714 | 5/12/2025 | Gast | - | Voice-overs voor beginners | €499.00 | `{"migration_source":"ID348299_voices.sql","participant_info":{"age":"","email":"Petra.D\\'Hoker@lv.vlaanderen.be","userId":12148,"lastName":"D’Hoker","firstName":"Petra","experience":"","profession":"Communicatiemedewerker"},"workshop_schedule":{"time":"","end_date":"2025-12-09T17:00:00Z","raw_date":"9 december 2025 van 10u00 tot 17u00","start_date":"2025-12-09T10:00:00Z"}}` |
| 6714 | 5/12/2025 | Gast | - | Voice-overs voor beginners | €0.00 | `{"migration_source":"ID348299_voices.sql","participant_info":{"age":"","email":"Petra.D\\'Hoker@lv.vlaanderen.be","userId":12148,"lastName":"D’Hoker","firstName":"Petra","experience":"","profession":"Communicatiemedewerker"},"workshop_schedule":{"time":"","raw_date":"9 december 2025 van 10u00 tot 17u00","clean_date":"2025-12-09T10:00:00Z"}}` |
| 6714 | 5/12/2025 | Gast | - | Voice-overs voor beginners | €0.00 | `{"migration_source":"ID348299_voices.sql","participant_info":{"age":"","email":"Petra.D\\'Hoker@lv.vlaanderen.be","userId":12148,"lastName":"D’Hoker","firstName":"Petra","experience":"","profession":"Communicatiemedewerker"},"workshop_schedule":{"time":"","end_date":"2025-12-09T17:00:00Z","raw_date":"9 december 2025 van 10u00 tot 17u00","start_date":"2025-12-09T10:00:00Z"}}` |
| 6714 | 5/12/2025 | Gast | - | Voice-overs voor beginners | €0.00 | `{"migration_source":"ID348299_voices.sql","participant_info":{"age":"","email":"Petra.D\\'Hoker@lv.vlaanderen.be","userId":12148,"lastName":"D’Hoker","firstName":"Petra","experience":"","profession":"Communicatiemedewerker"},"workshop_schedule":{"time":"","end_date":"2025-12-09T17:00:00Z","raw_date":"9 december 2025 van 10u00 tot 17u00","start_date":"2025-12-09T10:00:00Z"}}` |
| 6701 | 18/11/2025 | Gast | - | Voice-overs voor beginners | €0.00 | `{"migration_source":"ID348299_voices.sql","participant_info":{"email":"annelies.vanborren@gmail.com","lastName":"Vanborren","firstName":"Annelies"},"workshop_schedule":{"time":"","end_date":null,"raw_date":"09/12/2025","start_date":"2025-12-09T09:00:00Z"}}` |
| 6701 | 18/11/2025 | Gast | - | Voice-overs voor beginners | €0.00 | `{"migration_source":"ID348299_voices.sql","participant_info":{"age":"44","email":"annelies.vanborren@gmail.com","userId":10233,"lastName":"Vanborren","firstName":"Annelies","experience":"","profession":"Medewerker Stad Leuven"},"workshop_schedule":{"time":"","end_date":null,"raw_date":"09/12/2025","start_date":"2025-12-09T09:00:00Z"}}` |
| 6701 | 18/11/2025 | Gast | - | Voice-overs voor beginners | €0.00 | `{"migration_source":"ID348299_voices.sql","participant_info":{"email":"annelies.vanborren@gmail.com","userId":10233,"lastName":"Vanborren","firstName":"Annelies"},"workshop_schedule":{"time":"","end_date":null,"raw_date":"09/12/2025","start_date":"2025-12-09T09:00:00Z"}}` |
| 6701 | 18/11/2025 | Gast | - | Voice-overs voor beginners | €499.00 | `{"migration_source":"ID348299_voices.sql","participant_info":{"age":"44","email":"annelies.vanborren@gmail.com","userId":10233,"lastName":"Vanborren","firstName":"Annelies","experience":"","profession":"Medewerker Stad Leuven"},"workshop_schedule":{"time":"","end_date":null,"raw_date":"09/12/2025","start_date":"2025-12-09T09:00:00Z"}}` |
| 6701 | 18/11/2025 | Gast | - | Voice-overs voor beginners | €0.00 | `{"migration_source":"ID348299_voices.sql","participant_info":{"email":"annelies.vanborren@gmail.com","lastName":"Vanborren","firstName":"Annelies"},"workshop_schedule":{"time":"","end_date":null,"raw_date":"09/12/2025","start_date":"2025-12-09T09:00:00Z"}}` |
| 6701 | 18/11/2025 | Gast | - | Voice-overs voor beginners | €0.00 | `{"migration_source":"ID348299_voices.sql","participant_info":{"email":"annelies.vanborren@gmail.com","lastName":"Vanborren","firstName":"Annelies"},"workshop_schedule":{"time":"","end_date":null,"raw_date":"09/12/2025","start_date":"2025-12-09T09:00:00Z"}}` |
| 6688 | 11/11/2025 | Sabien Hanoulle | sabien.hanoulle@uantwerpen.be | Maak je eigen podcast | €499.00 | `{"migration_source":"ID348299_voices.sql","participant_info":{"age":"","email":"sabien.hanoulle@uantwerpen.be","userId":10470,"lastName":"Hanoulle","firstName":"Sabien","experience":"","profession":""},"workshop_schedule":{"time":"","end_date":null,"raw_date":"woensdag 25/02/2026 van 10u00 tot 17u00","start_date":"2026-02-25T09:00:00Z"}}` |
| 6685 | 8/11/2025 | Gast | - | Voice-overs voor beginners | €0.00 | `{"migration_source":"ID348299_voices.sql","participant_info":{"age":"","email":"ellenvanbochaute@gmail.com","userId":12131,"lastName":"","firstName":"","experience":"","profession":""},"workshop_schedule":{"time":"","end_date":null,"raw_date":"dinsdag 09/12/2025 van 10u00 tot 17u00","start_date":"2025-12-09T09:00:00Z"}}` |
| 6685 | 8/11/2025 | Gast | - | Voice-overs voor beginners | €0.00 | `{"migration_source":"ID348299_voices.sql","participant_info":{"email":"ellenvanbochaute@gmail.com","userId":12131,"lastName":"","firstName":""},"workshop_schedule":{"time":"","end_date":null,"raw_date":"dinsdag 09/12/2025 van 10u00 tot 17u00","start_date":"2025-12-09T09:00:00Z"}}` |
| 6685 | 8/11/2025 | Gast | - | Voice-overs voor beginners | €0.00 | `{"migration_source":"ID348299_voices.sql","participant_info":{"email":"ellenvanbochaute@gmail.com","lastName":"","firstName":""},"workshop_schedule":{"time":"","end_date":null,"raw_date":"dinsdag 09/12/2025 van 10u00 tot 17u00","start_date":"2025-12-09T09:00:00Z"}}` |
| 6685 | 8/11/2025 | Gast | - | Voice-overs voor beginners | €0.00 | `{"migration_source":"ID348299_voices.sql","participant_info":{"email":"ellenvanbochaute@gmail.com","lastName":"","firstName":""},"workshop_schedule":{"time":"","end_date":null,"raw_date":"dinsdag 09/12/2025 van 10u00 tot 17u00","start_date":"2025-12-09T09:00:00Z"}}` |
| 6685 | 8/11/2025 | Gast | - | Voice-overs voor beginners | €0.00 | `{"migration_source":"ID348299_voices.sql","participant_info":{"email":"ellenvanbochaute@gmail.com","lastName":"","firstName":""},"workshop_schedule":{"time":"","end_date":null,"raw_date":"dinsdag 09/12/2025 van 10u00 tot 17u00","start_date":"2025-12-09T09:00:00Z"}}` |
| 6685 | 8/11/2025 | Gast | - | Voice-overs voor beginners | €499.00 | `{"migration_source":"ID348299_voices.sql","participant_info":{"age":"","email":"ellenvanbochaute@gmail.com","userId":12131,"lastName":"Van Bochaute","firstName":"Ellen","experience":"","profession":""},"workshop_schedule":{"time":"","end_date":null,"raw_date":"dinsdag 09/12/2025 van 10u00 tot 17u00","start_date":"2025-12-09T09:00:00Z"}}` |
| 6684 | 6/11/2025 | Gast | - | Perfectie van intonatie | €0.00 | `{"migration_source":"ID348299_voices.sql","participant_info":{"email":"steven.de.beleyr@gmail.com","lastName":"","firstName":""},"workshop_schedule":{"time":"","end_date":null,"raw_date":"dinsdag 11/11/2025 van 09u00 tot 12u00","start_date":"2025-11-11T09:00:00Z"}}` |
| 6684 | 6/11/2025 | Gast | - | Perfectie van intonatie | €249.00 | `{"migration_source":"ID348299_voices.sql","participant_info":{"age":"","email":"steven.de.beleyr@gmail.com","userId":2045,"lastName":"","firstName":"","experience":"","profession":""},"workshop_schedule":{"time":"","end_date":null,"raw_date":"dinsdag 11/11/2025 van 09u00 tot 12u00","start_date":"2025-11-11T09:00:00Z"}}` |
| 6684 | 6/11/2025 | Gast | - | Perfectie van intonatie | €0.00 | `{"migration_source":"ID348299_voices.sql","participant_info":{"email":"steven.de.beleyr@gmail.com","lastName":"","firstName":""},"workshop_schedule":{"time":"","end_date":null,"raw_date":"dinsdag 11/11/2025 van 09u00 tot 12u00","start_date":"2025-11-11T09:00:00Z"}}` |
| 6684 | 6/11/2025 | Gast | - | Perfectie van intonatie | €0.00 | `{"migration_source":"ID348299_voices.sql","participant_info":{"email":"steven.de.beleyr@gmail.com","lastName":"","firstName":""},"workshop_schedule":{"time":"","end_date":null,"raw_date":"dinsdag 11/11/2025 van 09u00 tot 12u00","start_date":"2025-11-11T09:00:00Z"}}` |
| 6684 | 6/11/2025 | Gast | - | Perfectie van intonatie | €0.00 | `{"migration_source":"ID348299_voices.sql","participant_info":{"email":"steven.de.beleyr@gmail.com","userId":2045,"lastName":"","firstName":""},"workshop_schedule":{"time":"","end_date":null,"raw_date":"dinsdag 11/11/2025 van 09u00 tot 12u00","start_date":"2025-11-11T09:00:00Z"}}` |
| 6684 | 6/11/2025 | Gast | - | Perfectie van intonatie | €0.00 | `{"migration_source":"ID348299_voices.sql","participant_info":{"email":"steven.de.beleyr@gmail.com","lastName":"","firstName":""},"workshop_schedule":{"time":"","end_date":null,"raw_date":"dinsdag 11/11/2025 van 09u00 tot 12u00","start_date":"2025-11-11T09:00:00Z"}}` |
| 6681 | 6/11/2025 | Peter Verbeke | testaankoop@voices.be | Workshop op maat | €2994.00 | `{"migration_source":"ID348299_voices.sql","participant_info":{"age":"","email":"testaankoop@voices.be","userId":2043,"lastName":"Verbeke","firstName":"Peter","experience":"","profession":""},"workshop_schedule":{"time":"","end_date":null,"raw_date":"27/01/2026","start_date":"2026-01-27T09:00:00Z"}}` |
| 6657 | 26/10/2025 | Gast | - | Audioboeken inspreken | €0.00 | `{"migration_source":"ID348299_voices.sql","participant_info":{"email":"peter.ke@hotmail.com","userId":8728,"lastName":"","firstName":""},"workshop_schedule":{"time":"","end_date":null,"raw_date":"donderdag 27/11/2025 van 10u tot 17u","start_date":"2025-11-27T09:00:00Z"}}` |
| 6657 | 26/10/2025 | Gast | - | Maak je eigen podcast | €499.00 | `{"migration_source":"ID348299_voices.sql","participant_info":{"age":"","email":"peter.ke@hotmail.com","userId":8728,"lastName":"Kerschot","firstName":"Peter","experience":"","profession":""},"workshop_schedule":{"time":"","end_date":null,"raw_date":"woensdag 25/02/2026 van 10u00 tot 17u00","start_date":"2026-02-25T09:00:00Z"}}` |
| 6657 | 26/10/2025 | Gast | - | Audioboeken inspreken | €0.00 | `{"migration_source":"ID348299_voices.sql","participant_info":{"email":"peter.ke@hotmail.com","lastName":"","firstName":""},"workshop_schedule":{"time":"","end_date":null,"raw_date":"donderdag 27/11/2025 van 10u tot 17u","start_date":"2025-11-27T09:00:00Z"}}` |
| 6657 | 26/10/2025 | Gast | - | Audioboeken inspreken | €0.00 | `{"migration_source":"ID348299_voices.sql","participant_info":{"email":"peter.ke@hotmail.com","lastName":"","firstName":""},"workshop_schedule":{"time":"","end_date":null,"raw_date":"donderdag 27/11/2025 van 10u tot 17u","start_date":"2025-11-27T09:00:00Z"}}` |
| 6657 | 26/10/2025 | Gast | - | Audioboeken inspreken | €499.00 | `{"migration_source":"ID348299_voices.sql","participant_info":{"age":"","email":"peter.ke@hotmail.com","userId":8728,"lastName":"Kerschot","firstName":"Peter","experience":"","profession":""},"workshop_schedule":{"time":"","end_date":null,"raw_date":"donderdag 27/11/2025 van 10u tot 17u","start_date":"2025-11-27T09:00:00Z"}}` |
| 6657 | 26/10/2025 | Gast | - | Audioboeken inspreken | €0.00 | `{"migration_source":"ID348299_voices.sql","participant_info":{"age":"","email":"peter.ke@hotmail.com","userId":8728,"lastName":"","firstName":"","experience":"","profession":""},"workshop_schedule":{"time":"","end_date":null,"raw_date":"donderdag 27/11/2025 van 10u tot 17u","start_date":"2025-11-27T09:00:00Z"}}` |
| 6657 | 26/10/2025 | Gast | - | Audioboeken inspreken | €0.00 | `{"migration_source":"ID348299_voices.sql","participant_info":{"email":"peter.ke@hotmail.com","lastName":"","firstName":""},"workshop_schedule":{"time":"","end_date":null,"raw_date":"donderdag 27/11/2025 van 10u tot 17u","start_date":"2025-11-27T09:00:00Z"}}` |
| 6656 | 25/10/2025 | Gast | - | Perfectie van intonatie | €0.00 | `{"migration_source":"ID348299_voices.sql","participant_info":{"email":"annelies.vanborren@gmail.com","lastName":"","firstName":""},"workshop_schedule":{"time":"","end_date":null,"raw_date":"dinsdag 11/11/2025 van 09u00 tot 12u00","start_date":"2025-11-11T09:00:00Z"}}` |
| 6656 | 25/10/2025 | Gast | - | Perfectie van intonatie | €0.00 | `{"migration_source":"ID348299_voices.sql","participant_info":{"email":"annelies.vanborren@gmail.com","userId":10233,"lastName":"","firstName":""},"workshop_schedule":{"time":"","end_date":null,"raw_date":"dinsdag 11/11/2025 van 09u00 tot 12u00","start_date":"2025-11-11T09:00:00Z"}}` |
| 6656 | 25/10/2025 | Gast | - | Perfectie van intonatie | €249.00 | `{"migration_source":"ID348299_voices.sql","participant_info":{"age":"","email":"annelies.vanborren@gmail.com","userId":10233,"lastName":"Vanborren","firstName":"Annelies","experience":"","profession":""},"workshop_schedule":{"time":"","end_date":null,"raw_date":"dinsdag 11/11/2025 van 09u00 tot 12u00","start_date":"2025-11-11T09:00:00Z"}}` |
| 6656 | 25/10/2025 | Gast | - | Perfectie van intonatie | €0.00 | `{"migration_source":"ID348299_voices.sql","participant_info":{"age":"","email":"annelies.vanborren@gmail.com","userId":10233,"lastName":"","firstName":"","experience":"","profession":""},"workshop_schedule":{"time":"","end_date":null,"raw_date":"dinsdag 11/11/2025 van 09u00 tot 12u00","start_date":"2025-11-11T09:00:00Z"}}` |
| 6656 | 25/10/2025 | Gast | - | Perfectie van intonatie | €0.00 | `{"migration_source":"ID348299_voices.sql","participant_info":{"age":"","email":"annelies.vanborren@gmail.com","userId":10233,"lastName":"Vanborren","firstName":"Annelies","experience":"","profession":""},"workshop_schedule":{"time":"","end_date":null,"raw_date":"dinsdag 11/11/2025 van 09u00 tot 12u00","start_date":"2025-11-11T09:00:00Z"}}` |
| 6656 | 25/10/2025 | Gast | - | Perfectie van intonatie | €0.00 | `{"migration_source":"ID348299_voices.sql","participant_info":{"age":"","email":"annelies.vanborren@gmail.com","userId":10233,"lastName":"Vanborren","firstName":"Annelies","experience":"","profession":""},"workshop_schedule":{"time":"","end_date":null,"raw_date":"dinsdag 11/11/2025 van 09u00 tot 12u00","start_date":"2025-11-11T09:00:00Z"}}` |
| 6648 | 15/10/2025 | Gast | - | Voice-overs voor beginners | €0.00 | `{"migration_source":"ID348299_voices.sql","participant_info":{"age":"","email":"stephaniebxl@gmail.com","userId":12108,"lastName":"","firstName":"","experience":"","profession":""},"workshop_schedule":{"time":"","end_date":null,"raw_date":"woensdag 22/10/2025 van 10u00 tot 17u00","start_date":"2025-10-22T09:00:00Z"}}` |
| 6648 | 15/10/2025 | Gast | - | Voice-overs voor beginners | €0.00 | `{"migration_source":"ID348299_voices.sql","participant_info":{"email":"stephaniebxl@gmail.com","userId":12108,"lastName":"","firstName":""},"workshop_schedule":{"time":"","end_date":null,"raw_date":"woensdag 22/10/2025 van 10u00 tot 17u00","start_date":"2025-10-22T09:00:00Z"}}` |
| 6648 | 15/10/2025 | Gast | - | Voice-overs voor beginners | €499.00 | `{"migration_source":"ID348299_voices.sql","participant_info":{"age":"","email":"stephaniebxl@gmail.com","userId":12108,"lastName":"Lemmens","firstName":"Stephanie","experience":"","profession":""},"workshop_schedule":{"time":"","end_date":null,"raw_date":"woensdag 22/10/2025 van 10u00 tot 17u00","start_date":"2025-10-22T09:00:00Z"}}` |
| 6648 | 15/10/2025 | Gast | - | Voice-overs voor beginners | €0.00 | `{"migration_source":"ID348299_voices.sql","participant_info":{"email":"stephaniebxl@gmail.com","lastName":"","firstName":""},"workshop_schedule":{"time":"","end_date":null,"raw_date":"woensdag 22/10/2025 van 10u00 tot 17u00","start_date":"2025-10-22T09:00:00Z"}}` |
| 6648 | 15/10/2025 | Gast | - | Voice-overs voor beginners | €0.00 | `{"migration_source":"ID348299_voices.sql","participant_info":{"email":"stephaniebxl@gmail.com","lastName":"","firstName":""},"workshop_schedule":{"time":"","end_date":null,"raw_date":"woensdag 22/10/2025 van 10u00 tot 17u00","start_date":"2025-10-22T09:00:00Z"}}` |
| 6648 | 15/10/2025 | Gast | - | Voice-overs voor beginners | €0.00 | `{"migration_source":"ID348299_voices.sql","participant_info":{"email":"stephaniebxl@gmail.com","lastName":"","firstName":""},"workshop_schedule":{"time":"","end_date":null,"raw_date":"woensdag 22/10/2025 van 10u00 tot 17u00","start_date":"2025-10-22T09:00:00Z"}}` |
| 6642 | 8/10/2025 | Gast | - | Voice-overs voor beginners | €499.00 | `{"migration_source":"ID348299_voices.sql","participant_info":{"age":"","email":"hans.vanderspikken@gmail.com","userId":10328,"lastName":"Vanderspikken","firstName":"Hans","experience":"","profession":""},"workshop_schedule":{"time":"","end_date":null,"raw_date":"vrijdag 21/11/2025 van 10u00 tot 17u00","start_date":"2025-11-21T09:00:00Z"}}` |
| 6642 | 8/10/2025 | Gast | - | Voice-overs voor beginners | €0.00 | `{"migration_source":"ID348299_voices.sql","participant_info":{"email":"hans.vanderspikken@gmail.com","lastName":"","firstName":""},"workshop_schedule":{"time":"","end_date":null,"raw_date":"vrijdag 21/11/2025 van 10u00 tot 17u00","start_date":"2025-11-21T09:00:00Z"}}` |
| 6642 | 8/10/2025 | Gast | - | Voice-overs voor beginners | €0.00 | `{"migration_source":"ID348299_voices.sql","participant_info":{"email":"hans.vanderspikken@gmail.com","lastName":"","firstName":""},"workshop_schedule":{"time":"","end_date":null,"raw_date":"vrijdag 21/11/2025 van 10u00 tot 17u00","start_date":"2025-11-21T09:00:00Z"}}` |
| 6642 | 8/10/2025 | Gast | - | Voice-overs voor beginners | €0.00 | `{"migration_source":"ID348299_voices.sql","participant_info":{"age":"","email":"hans.vanderspikken@gmail.com","userId":10328,"lastName":"","firstName":"","experience":"","profession":""},"workshop_schedule":{"time":"","end_date":null,"raw_date":"vrijdag 21/11/2025 van 10u00 tot 17u00","start_date":"2025-11-21T09:00:00Z"}}` |
| 6642 | 8/10/2025 | Gast | - | Voice-overs voor beginners | €0.00 | `{"migration_source":"ID348299_voices.sql","participant_info":{"email":"hans.vanderspikken@gmail.com","userId":10328,"lastName":"","firstName":""},"workshop_schedule":{"time":"","end_date":null,"raw_date":"vrijdag 21/11/2025 van 10u00 tot 17u00","start_date":"2025-11-21T09:00:00Z"}}` |
| 6642 | 8/10/2025 | Gast | - | Voice-overs voor beginners | €0.00 | `{"migration_source":"ID348299_voices.sql","participant_info":{"email":"hans.vanderspikken@gmail.com","lastName":"","firstName":""},"workshop_schedule":{"time":"","end_date":null,"raw_date":"vrijdag 21/11/2025 van 10u00 tot 17u00","start_date":"2025-11-21T09:00:00Z"}}` |
| 6944 | 8/10/2025 | Gast | - | Voice-overs voor beginners | €0.00 | `{"migration_source":"ID348299_voices.sql","participant_info":{"age":"","email":"hans.vanderspikken@gmail.com","userId":10328,"lastName":"","firstName":"","experience":"","profession":""},"workshop_schedule":{"time":"","end_date":null,"raw_date":"vrijdag 21/11/2025 van 10u00 tot 17u00","start_date":"2025-11-21T09:00:00Z"}}` |
| 6944 | 8/10/2025 | Gast | - | Voice-overs voor beginners | €0.00 | `{"migration_source":"ID348299_voices.sql","participant_info":{"email":"hans.vanderspikken@gmail.com","userId":10328,"lastName":"","firstName":""},"workshop_schedule":{"time":"","end_date":null,"raw_date":"vrijdag 21/11/2025 van 10u00 tot 17u00","start_date":"2025-11-21T09:00:00Z"}}` |
| 6944 | 8/10/2025 | Gast | - | Voice-overs voor beginners | €0.00 | `{"migration_source":"ID348299_voices.sql","participant_info":{"email":"hans.vanderspikken@gmail.com","lastName":"","firstName":""},"workshop_schedule":{"time":"","end_date":null,"raw_date":"vrijdag 21/11/2025 van 10u00 tot 17u00","start_date":"2025-11-21T09:00:00Z"}}` |
| 6944 | 8/10/2025 | Gast | - | Voice-overs voor beginners | €0.00 | `{"migration_source":"ID348299_voices.sql","participant_info":{"email":"hans.vanderspikken@gmail.com","lastName":"","firstName":""},"workshop_schedule":{"time":"","end_date":null,"raw_date":"vrijdag 21/11/2025 van 10u00 tot 17u00","start_date":"2025-11-21T09:00:00Z"}}` |
| 6944 | 8/10/2025 | Gast | - | Voice-overs voor beginners | €0.00 | `{"migration_source":"ID348299_voices.sql","participant_info":{"email":"hans.vanderspikken@gmail.com","lastName":"","firstName":""},"workshop_schedule":{"time":"","end_date":null,"raw_date":"vrijdag 21/11/2025 van 10u00 tot 17u00","start_date":"2025-11-21T09:00:00Z"}}` |
| 6818 | 8/10/2025 | Gast | - | Voice-overs voor beginners | €0.00 | `{"migration_source":"ID348299_voices.sql","participant_info":{"email":"marte.caeldries@cm.be","userId":12094,"lastName":"","firstName":""},"workshop_schedule":{"time":"","end_date":null,"raw_date":"vrijdag 21/11/2025 van 10u00 tot 17u00","start_date":"2025-11-21T09:00:00Z"}}` |
| 6818 | 8/10/2025 | Gast | - | Voice-overs voor beginners | €0.00 | `{"migration_source":"ID348299_voices.sql","participant_info":{"email":"marte.caeldries@cm.be","lastName":"","firstName":""},"workshop_schedule":{"time":"","end_date":null,"raw_date":"vrijdag 21/11/2025 van 10u00 tot 17u00","start_date":"2025-11-21T09:00:00Z"}}` |
| 6818 | 8/10/2025 | Gast | - | Voice-overs voor beginners | €0.00 | `{"migration_source":"ID348299_voices.sql","participant_info":{"age":"","email":"marte.caeldries@cm.be","userId":12094,"lastName":"","firstName":"","experience":"","profession":""},"workshop_schedule":{"time":"","end_date":null,"raw_date":"vrijdag 21/11/2025 van 10u00 tot 17u00","start_date":"2025-11-21T09:00:00Z"}}` |
| 6818 | 8/10/2025 | Gast | - | Voice-overs voor beginners | €0.00 | `{"migration_source":"ID348299_voices.sql","participant_info":{"email":"marte.caeldries@cm.be","lastName":"","firstName":""},"workshop_schedule":{"time":"","end_date":null,"raw_date":"vrijdag 21/11/2025 van 10u00 tot 17u00","start_date":"2025-11-21T09:00:00Z"}}` |
| 6818 | 8/10/2025 | Gast | - | Voice-overs voor beginners | €0.00 | `{"migration_source":"ID348299_voices.sql","participant_info":{"email":"marte.caeldries@cm.be","lastName":"","firstName":""},"workshop_schedule":{"time":"","end_date":null,"raw_date":"vrijdag 21/11/2025 van 10u00 tot 17u00","start_date":"2025-11-21T09:00:00Z"}}` |
| 6640 | 6/10/2025 | Gast | - | Perfectie van intonatie | €0.00 | `{"migration_source":"ID348299_voices.sql","participant_info":{"email":"lieke@groepspraktijkkompas.be","lastName":"","firstName":""},"workshop_schedule":{"time":"","end_date":null,"raw_date":"dinsdag 11/11/2025 van 09u00 tot 12u00","start_date":"2025-11-11T09:00:00Z"}}` |
| 6640 | 6/10/2025 | Gast | - | Perfectie van intonatie | €0.00 | `{"migration_source":"ID348299_voices.sql","participant_info":{"email":"lieke@groepspraktijkkompas.be","lastName":"","firstName":""},"workshop_schedule":{"time":"","end_date":null,"raw_date":"dinsdag 11/11/2025 van 09u00 tot 12u00","start_date":"2025-11-11T09:00:00Z"}}` |
| 6640 | 6/10/2025 | Gast | - | Perfectie van intonatie | €0.00 | `{"migration_source":"ID348299_voices.sql","participant_info":{"email":"lieke@groepspraktijkkompas.be","lastName":"","firstName":""},"workshop_schedule":{"time":"","end_date":null,"raw_date":"dinsdag 11/11/2025 van 09u00 tot 12u00","start_date":"2025-11-11T09:00:00Z"}}` |
| 6640 | 6/10/2025 | Gast | - | Perfectie van intonatie | €249.00 | `{"migration_source":"ID348299_voices.sql","participant_info":{"age":"","email":"lieke@groepspraktijkkompas.be","userId":2012,"lastName":"","firstName":"","experience":"","profession":""},"workshop_schedule":{"time":"","end_date":null,"raw_date":"dinsdag 11/11/2025 van 09u00 tot 12u00","start_date":"2025-11-11T09:00:00Z"}}` |
| 6640 | 6/10/2025 | Gast | - | Perfectie van intonatie | €0.00 | `{"migration_source":"ID348299_voices.sql","participant_info":{"email":"lieke@groepspraktijkkompas.be","lastName":"","firstName":""},"workshop_schedule":{"time":"","end_date":null,"raw_date":"dinsdag 11/11/2025 van 09u00 tot 12u00","start_date":"2025-11-11T09:00:00Z"}}` |
| 6640 | 6/10/2025 | Gast | - | Perfectie van intonatie | €0.00 | `{"migration_source":"ID348299_voices.sql","participant_info":{"email":"lieke@groepspraktijkkompas.be","userId":2012,"lastName":"","firstName":""},"workshop_schedule":{"time":"","end_date":null,"raw_date":"dinsdag 11/11/2025 van 09u00 tot 12u00","start_date":"2025-11-11T09:00:00Z"}}` |
| 6942 | 30/9/2025 | Gast | lieke@groepspraktijkkompas.be | Perfectie van intonatie | €0.00 | `{"migration_source":"ID348299_voices.sql","participant_info":{"email":"lieke@groepspraktijkkompas.be","lastName":"","firstName":""},"workshop_schedule":{"time":"","end_date":null,"raw_date":"donderdag 09/10/2025 van 14u00 tot 17u00","start_date":"2025-10-09T09:00:00Z"}}` |
| 6942 | 30/9/2025 | Gast | lieke@groepspraktijkkompas.be | Perfectie van intonatie | €0.00 | `{"migration_source":"ID348299_voices.sql","participant_info":{"age":"","email":"lieke@groepspraktijkkompas.be","userId":2012,"lastName":"Hoppenbrouwers","firstName":"Lieke","experience":"","profession":""},"workshop_schedule":{"time":"","end_date":null,"raw_date":"donderdag 09/10/2025 van 14u00 tot 17u00","start_date":"2025-10-09T09:00:00Z"}}` |
| 6942 | 30/9/2025 | Gast | lieke@groepspraktijkkompas.be | Perfectie van intonatie | €0.00 | `{"migration_source":"ID348299_voices.sql","participant_info":{"email":"lieke@groepspraktijkkompas.be","lastName":"","firstName":""},"workshop_schedule":{"time":"","end_date":null,"raw_date":"donderdag 09/10/2025 van 14u00 tot 17u00","start_date":"2025-10-09T09:00:00Z"}}` |
| 6942 | 30/9/2025 | Gast | lieke@groepspraktijkkompas.be | Perfectie van intonatie | €0.00 | `{"migration_source":"ID348299_voices.sql","participant_info":{"email":"lieke@groepspraktijkkompas.be","userId":2012,"lastName":"","firstName":""},"workshop_schedule":{"time":"","end_date":null,"raw_date":"donderdag 09/10/2025 van 14u00 tot 17u00","start_date":"2025-10-09T09:00:00Z"}}` |
| 6942 | 30/9/2025 | Gast | lieke@groepspraktijkkompas.be | Perfectie van intonatie | €0.00 | `{"migration_source":"ID348299_voices.sql","participant_info":{"email":"lieke@groepspraktijkkompas.be","lastName":"","firstName":""},"workshop_schedule":{"time":"","end_date":null,"raw_date":"donderdag 09/10/2025 van 14u00 tot 17u00","start_date":"2025-10-09T09:00:00Z"}}` |
| 6625 | 23/9/2025 | Ine Vandeweyers | ine.vandeweyers@demens.nu | Voice-overs voor beginners | €0.00 | `{"migration_source":"ID348299_voices.sql","participant_info":{"email":"ine.vandeweyers@demens.nu","userId":2008,"lastName":"","firstName":""},"workshop_schedule":{"time":"","end_date":null,"raw_date":"woensdag 22/10/2025 van 10u00 tot 17u00","start_date":"2025-10-22T09:00:00Z"}}` |
| 6625 | 23/9/2025 | Ine Vandeweyers | ine.vandeweyers@demens.nu | Voice-overs voor beginners | €0.00 | `{"migration_source":"ID348299_voices.sql","participant_info":{"email":"ine.vandeweyers@demens.nu","lastName":"","firstName":""},"workshop_schedule":{"time":"","end_date":null,"raw_date":"woensdag 22/10/2025 van 10u00 tot 17u00","start_date":"2025-10-22T09:00:00Z"}}` |
| 6625 | 23/9/2025 | Ine Vandeweyers | ine.vandeweyers@demens.nu | Voice-overs voor beginners | €0.00 | `{"migration_source":"ID348299_voices.sql","participant_info":{"age":"","email":"ine.vandeweyers@demens.nu","userId":2008,"lastName":"Vandeweyers","firstName":"Ine","experience":"","profession":""},"workshop_schedule":{"time":"","end_date":null,"raw_date":"woensdag 22/10/2025 van 10u00 tot 17u00","start_date":"2025-10-22T09:00:00Z"}}` |
| 6625 | 23/9/2025 | Ine Vandeweyers | ine.vandeweyers@demens.nu | Voice-overs voor beginners | €499.00 | `{"migration_source":"ID348299_voices.sql","participant_info":{"age":"","email":"ine.vandeweyers@demens.nu","userId":2008,"lastName":"Vandeweyers","firstName":"Ine","experience":"","profession":""},"workshop_schedule":{"time":"","end_date":null,"raw_date":"woensdag 22/10/2025 van 10u00 tot 17u00","start_date":"2025-10-22T09:00:00Z"}}` |
| 6625 | 23/9/2025 | Ine Vandeweyers | ine.vandeweyers@demens.nu | Voice-overs voor beginners | €0.00 | `{"migration_source":"ID348299_voices.sql","participant_info":{"email":"ine.vandeweyers@demens.nu","lastName":"","firstName":""},"workshop_schedule":{"time":"","end_date":null,"raw_date":"woensdag 22/10/2025 van 10u00 tot 17u00","start_date":"2025-10-22T09:00:00Z"}}` |
| 6625 | 23/9/2025 | Ine Vandeweyers | ine.vandeweyers@demens.nu | Voice-overs voor beginners | €0.00 | `{"migration_source":"ID348299_voices.sql","participant_info":{"email":"ine.vandeweyers@demens.nu","lastName":"","firstName":""},"workshop_schedule":{"time":"","end_date":null,"raw_date":"woensdag 22/10/2025 van 10u00 tot 17u00","start_date":"2025-10-22T09:00:00Z"}}` |
| 6619 | 16/9/2025 | Kris Sibelle Dedeurwaerder | sibelle.kris@gmail.com | Voice-overs voor beginners | €0.00 | `{"migration_source":"ID348299_voices.sql","participant_info":{"email":"sibelle.kris@gmail.com","userId":11170,"lastName":"","firstName":""},"workshop_schedule":{"time":"","end_date":null,"raw_date":"vrijdag 21/11/2025 van 10u00 tot 17u00","start_date":"2025-11-21T09:00:00Z"}}` |
| 6619 | 16/9/2025 | Kris Sibelle Dedeurwaerder | sibelle.kris@gmail.com | Voice-overs voor beginners | €0.00 | `{"migration_source":"ID348299_voices.sql","participant_info":{"email":"sibelle.kris@gmail.com","lastName":"","firstName":""},"workshop_schedule":{"time":"","end_date":null,"raw_date":"vrijdag 21/11/2025 van 10u00 tot 17u00","start_date":"2025-11-21T09:00:00Z"}}` |
| 6619 | 16/9/2025 | Kris Sibelle Dedeurwaerder | sibelle.kris@gmail.com | Voice-overs voor beginners | €499.00 | `{"migration_source":"ID348299_voices.sql","participant_info":{"age":"","email":"sibelle.kris@gmail.com","userId":11170,"lastName":"Dedeurwaerder","firstName":"Kris Sibelle","experience":"","profession":""},"workshop_schedule":{"time":"","end_date":null,"raw_date":"vrijdag 21/11/2025 van 10u00 tot 17u00","start_date":"2025-11-21T09:00:00Z"}}` |
| 6619 | 16/9/2025 | Kris Sibelle Dedeurwaerder | sibelle.kris@gmail.com | Voice-overs voor beginners | €0.00 | `{"migration_source":"ID348299_voices.sql","participant_info":{"email":"sibelle.kris@gmail.com","lastName":"","firstName":""},"workshop_schedule":{"time":"","end_date":null,"raw_date":"vrijdag 21/11/2025 van 10u00 tot 17u00","start_date":"2025-11-21T09:00:00Z"}}` |
| 6619 | 16/9/2025 | Kris Sibelle Dedeurwaerder | sibelle.kris@gmail.com | Voice-overs voor beginners | €0.00 | `{"migration_source":"ID348299_voices.sql","participant_info":{"email":"sibelle.kris@gmail.com","lastName":"","firstName":""},"workshop_schedule":{"time":"","end_date":null,"raw_date":"vrijdag 21/11/2025 van 10u00 tot 17u00","start_date":"2025-11-21T09:00:00Z"}}` |
| 6619 | 16/9/2025 | Kris Sibelle Dedeurwaerder | sibelle.kris@gmail.com | Voice-overs voor beginners | €0.00 | `{"migration_source":"ID348299_voices.sql","participant_info":{"age":"","email":"sibelle.kris@gmail.com","userId":11170,"lastName":"Dedeurwaerder","firstName":"Kris Sibelle","experience":"","profession":""},"workshop_schedule":{"time":"","end_date":null,"raw_date":"vrijdag 21/11/2025 van 10u00 tot 17u00","start_date":"2025-11-21T09:00:00Z"}}` |
| 6941 | 11/9/2025 | Maarten van Linden | maartenvl87@hotmail.com | Maak je eigen radioshow | €0.00 | `{"migration_source":"ID348299_voices.sql","participant_info":{"age":"","email":"maartenvl87@hotmail.com","userId":10206,"lastName":"van Linden","firstName":"Maarten","experience":"","profession":""},"workshop_schedule":{"time":"","end_date":null,"raw_date":"zaterdag 29/11/2025 van 10u00 tot 17u00","start_date":"2025-11-29T09:00:00Z"}}` |
| 6941 | 11/9/2025 | Maarten van Linden | maartenvl87@hotmail.com | Maak je eigen radioshow | €0.00 | `{"migration_source":"ID348299_voices.sql","participant_info":{"email":"maartenvl87@hotmail.com","lastName":"","firstName":""},"workshop_schedule":{"time":"","end_date":null,"raw_date":"zaterdag 29/11/2025 van 10u00 tot 17u00","start_date":"2025-11-29T09:00:00Z"}}` |
| 6941 | 11/9/2025 | Maarten van Linden | maartenvl87@hotmail.com | Maak je eigen radioshow | €0.00 | `{"migration_source":"ID348299_voices.sql","participant_info":{"email":"maartenvl87@hotmail.com","userId":10206,"lastName":"","firstName":""},"workshop_schedule":{"time":"","end_date":null,"raw_date":"zaterdag 29/11/2025 van 10u00 tot 17u00","start_date":"2025-11-29T09:00:00Z"}}` |
| 6941 | 11/9/2025 | Maarten van Linden | maartenvl87@hotmail.com | Maak je eigen radioshow | €0.00 | `{"migration_source":"ID348299_voices.sql","participant_info":{"email":"maartenvl87@hotmail.com","lastName":"","firstName":""},"workshop_schedule":{"time":"","end_date":null,"raw_date":"zaterdag 29/11/2025 van 10u00 tot 17u00","start_date":"2025-11-29T09:00:00Z"}}` |
| 6941 | 11/9/2025 | Maarten van Linden | maartenvl87@hotmail.com | Maak je eigen radioshow | €0.00 | `{"migration_source":"ID348299_voices.sql","participant_info":{"email":"maartenvl87@hotmail.com","lastName":"","firstName":""},"workshop_schedule":{"time":"","end_date":null,"raw_date":"zaterdag 29/11/2025 van 10u00 tot 17u00","start_date":"2025-11-29T09:00:00Z"}}` |
| 6614 | 10/9/2025 | Filip Sillis | filip.sillis@outlook.com | Maak je eigen podcast | €499.00 | `{"migration_source":"ID348299_voices.sql","participant_info":{"age":"","email":"filip.sillis@outlook.com","userId":12028,"lastName":"Sillis","firstName":"Filip","experience":"","profession":""},"workshop_schedule":{"time":"","end_date":null,"raw_date":"vrijdag 06/02/2026 van 10u00 tot 17u00","start_date":"2026-02-06T09:00:00Z"}}` |
| 6613 | 10/9/2025 | Filip Sillis | filip.sillis@outlook.com | Voice-overs voor beginners | €499.00 | `{"migration_source":"ID348299_voices.sql","participant_info":{"age":"","email":"filip.sillis@outlook.com","userId":12028,"lastName":"Sillis","firstName":"Filip","experience":"","profession":""},"workshop_schedule":{"time":"","end_date":null,"raw_date":"vrijdag 21/11/2025 van 10u00 tot 17u00","start_date":"2025-11-21T09:00:00Z"}}` |
| 6613 | 10/9/2025 | Filip Sillis | filip.sillis@outlook.com | Voice-overs voor beginners | €0.00 | `{"migration_source":"ID348299_voices.sql","participant_info":{"age":"","email":"filip.sillis@outlook.com","userId":12028,"lastName":"Sillis","firstName":"Filip","experience":"","profession":""},"workshop_schedule":{"time":"","end_date":null,"raw_date":"vrijdag 21/11/2025 van 10u00 tot 17u00","start_date":"2025-11-21T09:00:00Z"}}` |
| 6613 | 10/9/2025 | Filip Sillis | filip.sillis@outlook.com | Voice-overs voor beginners | €0.00 | `{"migration_source":"ID348299_voices.sql","participant_info":{"email":"filip.sillis@outlook.com","lastName":"","firstName":""},"workshop_schedule":{"time":"","end_date":null,"raw_date":"vrijdag 21/11/2025 van 10u00 tot 17u00","start_date":"2025-11-21T09:00:00Z"}}` |
| 6613 | 10/9/2025 | Filip Sillis | filip.sillis@outlook.com | Voice-overs voor beginners | €0.00 | `{"migration_source":"ID348299_voices.sql","participant_info":{"email":"filip.sillis@outlook.com","lastName":"","firstName":""},"workshop_schedule":{"time":"","end_date":null,"raw_date":"vrijdag 21/11/2025 van 10u00 tot 17u00","start_date":"2025-11-21T09:00:00Z"}}` |
| 6613 | 10/9/2025 | Filip Sillis | filip.sillis@outlook.com | Voice-overs voor beginners | €0.00 | `{"migration_source":"ID348299_voices.sql","participant_info":{"email":"filip.sillis@outlook.com","lastName":"","firstName":""},"workshop_schedule":{"time":"","end_date":null,"raw_date":"vrijdag 21/11/2025 van 10u00 tot 17u00","start_date":"2025-11-21T09:00:00Z"}}` |
| 6613 | 10/9/2025 | Filip Sillis | filip.sillis@outlook.com | Voice-overs voor beginners | €0.00 | `{"migration_source":"ID348299_voices.sql","participant_info":{"email":"filip.sillis@outlook.com","userId":12028,"lastName":"","firstName":""},"workshop_schedule":{"time":"","end_date":null,"raw_date":"vrijdag 21/11/2025 van 10u00 tot 17u00","start_date":"2025-11-21T09:00:00Z"}}` |
| 6609 | 9/9/2025 | Anja Szondi | anja@vitasense.be | Voice-overs voor beginners | €0.00 | `{"migration_source":"ID348299_voices.sql","participant_info":{"email":"anja@vitasense.be","lastName":"","firstName":""},"workshop_schedule":{"time":"","end_date":null,"raw_date":"vrijdag 19/09/2025 van 10u00 tot 17u00","start_date":"2025-09-19T09:00:00Z"}}` |
| 6609 | 9/9/2025 | Anja Szondi | anja@vitasense.be | Voice-overs voor beginners | €0.00 | `{"migration_source":"ID348299_voices.sql","participant_info":{"age":"","email":"anja@vitasense.be","userId":12023,"lastName":"Szondi","firstName":"Anja","experience":"","profession":""},"workshop_schedule":{"time":"","end_date":null,"raw_date":"vrijdag 19/09/2025 van 10u00 tot 17u00","start_date":"2025-09-19T09:00:00Z"}}` |
| 6609 | 9/9/2025 | Anja Szondi | anja@vitasense.be | Voice-overs voor beginners | €0.00 | `{"migration_source":"ID348299_voices.sql","participant_info":{"email":"anja@vitasense.be","lastName":"","firstName":""},"workshop_schedule":{"time":"","end_date":null,"raw_date":"vrijdag 19/09/2025 van 10u00 tot 17u00","start_date":"2025-09-19T09:00:00Z"}}` |
| 6609 | 9/9/2025 | Anja Szondi | anja@vitasense.be | Voice-overs voor beginners | €499.00 | `{"migration_source":"ID348299_voices.sql","participant_info":{"age":"","email":"anja@vitasense.be","userId":12023,"lastName":"Szondi","firstName":"Anja","experience":"","profession":""},"workshop_schedule":{"time":"","end_date":null,"raw_date":"vrijdag 19/09/2025 van 10u00 tot 17u00","start_date":"2025-09-19T09:00:00Z"}}` |
| 6609 | 9/9/2025 | Anja Szondi | anja@vitasense.be | Voice-overs voor beginners | €0.00 | `{"migration_source":"ID348299_voices.sql","participant_info":{"email":"anja@vitasense.be","userId":12023,"lastName":"","firstName":""},"workshop_schedule":{"time":"","end_date":null,"raw_date":"vrijdag 19/09/2025 van 10u00 tot 17u00","start_date":"2025-09-19T09:00:00Z"}}` |
| 6609 | 9/9/2025 | Anja Szondi | anja@vitasense.be | Voice-overs voor beginners | €0.00 | `{"migration_source":"ID348299_voices.sql","participant_info":{"age":"","email":"anja@vitasense.be","userId":12023,"lastName":"Szondi","firstName":"Anja","experience":"","profession":""},"workshop_schedule":{"time":"","end_date":null,"raw_date":"vrijdag 19/09/2025 van 10u00 tot 17u00","start_date":"2025-09-19T09:00:00Z"}}` |
| 6604 | 8/9/2025 | Jolijn Boons | jolijnboons@hotmail.com | Voice-overs voor beginners | €499.00 | `{"migration_source":"ID348299_voices.sql","participant_info":{"age":"","email":"jolijnboons@hotmail.com","userId":10708,"lastName":"Boons","firstName":"Jolijn","experience":"","profession":""},"workshop_schedule":{"time":"","end_date":null,"raw_date":"vrijdag 19/09/2025 van 10u00 tot 17u00","start_date":"2025-09-19T09:00:00Z"}}` |
| 6604 | 8/9/2025 | Jolijn Boons | jolijnboons@hotmail.com | Voice-overs voor beginners | €0.00 | `{"migration_source":"ID348299_voices.sql","participant_info":{"email":"jolijnboons@hotmail.com","userId":10708,"lastName":"","firstName":""},"workshop_schedule":{"time":"","end_date":null,"raw_date":"vrijdag 19/09/2025 van 10u00 tot 17u00","start_date":"2025-09-19T09:00:00Z"}}` |
| 6604 | 8/9/2025 | Jolijn Boons | jolijnboons@hotmail.com | Voice-overs voor beginners | €0.00 | `{"migration_source":"ID348299_voices.sql","participant_info":{"email":"jolijnboons@hotmail.com","lastName":"","firstName":""},"workshop_schedule":{"time":"","end_date":null,"raw_date":"vrijdag 19/09/2025 van 10u00 tot 17u00","start_date":"2025-09-19T09:00:00Z"}}` |
| 6604 | 8/9/2025 | Jolijn Boons | jolijnboons@hotmail.com | Voice-overs voor beginners | €0.00 | `{"migration_source":"ID348299_voices.sql","participant_info":{"email":"jolijnboons@hotmail.com","lastName":"","firstName":""},"workshop_schedule":{"time":"","end_date":null,"raw_date":"vrijdag 19/09/2025 van 10u00 tot 17u00","start_date":"2025-09-19T09:00:00Z"}}` |
| 6604 | 8/9/2025 | Jolijn Boons | jolijnboons@hotmail.com | Voice-overs voor beginners | €0.00 | `{"migration_source":"ID348299_voices.sql","participant_info":{"age":"","email":"jolijnboons@hotmail.com","userId":10708,"lastName":"Boons","firstName":"Jolijn","experience":"","profession":""},"workshop_schedule":{"time":"","end_date":null,"raw_date":"vrijdag 19/09/2025 van 10u00 tot 17u00","start_date":"2025-09-19T09:00:00Z"}}` |
| 6604 | 8/9/2025 | Jolijn Boons | jolijnboons@hotmail.com | Voice-overs voor beginners | €0.00 | `{"migration_source":"ID348299_voices.sql","participant_info":{"email":"jolijnboons@hotmail.com","lastName":"","firstName":""},"workshop_schedule":{"time":"","end_date":null,"raw_date":"vrijdag 19/09/2025 van 10u00 tot 17u00","start_date":"2025-09-19T09:00:00Z"}}` |
| 6598 | 1/9/2025 | Elise Selderslaghs | elise.selderslaghs@gmail.com | Voice-overs voor beginners | €0.00 | `{"migration_source":"ID348299_voices.sql","participant_info":{"age":"","email":"elise.selderslaghs@gmail.com","userId":12010,"lastName":"Selderslaghs","firstName":"Elise","experience":"","profession":""},"workshop_schedule":{"time":"","end_date":null,"raw_date":"woensdag 22/10/2025 van 10u00 tot 17u00","start_date":"2025-10-22T09:00:00Z"}}` |
| 6598 | 1/9/2025 | Elise Selderslaghs | elise.selderslaghs@gmail.com | Voice-overs voor beginners | €0.00 | `{"migration_source":"ID348299_voices.sql","participant_info":{"email":"elise.selderslaghs@gmail.com","lastName":"","firstName":""},"workshop_schedule":{"time":"","end_date":null,"raw_date":"woensdag 22/10/2025 van 10u00 tot 17u00","start_date":"2025-10-22T09:00:00Z"}}` |
| 6598 | 1/9/2025 | Elise Selderslaghs | elise.selderslaghs@gmail.com | Voice-overs voor beginners | €0.00 | `{"migration_source":"ID348299_voices.sql","participant_info":{"email":"elise.selderslaghs@gmail.com","userId":12010,"lastName":"","firstName":""},"workshop_schedule":{"time":"","end_date":null,"raw_date":"woensdag 22/10/2025 van 10u00 tot 17u00","start_date":"2025-10-22T09:00:00Z"}}` |
| 6598 | 1/9/2025 | Elise Selderslaghs | elise.selderslaghs@gmail.com | Voice-overs voor beginners | €0.00 | `{"migration_source":"ID348299_voices.sql","participant_info":{"email":"elise.selderslaghs@gmail.com","lastName":"","firstName":""},"workshop_schedule":{"time":"","end_date":null,"raw_date":"woensdag 22/10/2025 van 10u00 tot 17u00","start_date":"2025-10-22T09:00:00Z"}}` |
| 6598 | 1/9/2025 | Elise Selderslaghs | elise.selderslaghs@gmail.com | Voice-overs voor beginners | €499.00 | `{"migration_source":"ID348299_voices.sql","participant_info":{"age":"","email":"elise.selderslaghs@gmail.com","userId":12010,"lastName":"Selderslaghs","firstName":"Elise","experience":"","profession":""},"workshop_schedule":{"time":"","end_date":null,"raw_date":"woensdag 22/10/2025 van 10u00 tot 17u00","start_date":"2025-10-22T09:00:00Z"}}` |
| 6598 | 1/9/2025 | Elise Selderslaghs | elise.selderslaghs@gmail.com | Voice-overs voor beginners | €0.00 | `{"migration_source":"ID348299_voices.sql","participant_info":{"age":"","email":"elise.selderslaghs@gmail.com","userId":12010,"lastName":"Selderslaghs","firstName":"Elise","experience":"","profession":""},"workshop_schedule":{"time":"","end_date":null,"raw_date":"woensdag 22/10/2025 van 10u00 tot 17u00","start_date":"2025-10-22T09:00:00Z"}}` |
| 6597 | 1/9/2025 | Yone Van Kerkhove | yone.van.kerkhove2005@gmail.com | Perfectie van articulatie | €0.00 | `{"migration_source":"ID348299_voices.sql","participant_info":{"email":"yone.van.kerkhove2005@gmail.com","lastName":"","firstName":""},"workshop_schedule":{"time":"","end_date":null,"raw_date":"maandag 08/09/2025 van 10u00 tot 13u00","start_date":"2025-09-08T09:00:00Z"}}` |
| 6597 | 1/9/2025 | Yone Van Kerkhove | yone.van.kerkhove2005@gmail.com | Perfectie van articulatie | €0.00 | `{"migration_source":"ID348299_voices.sql","participant_info":{"email":"yone.van.kerkhove2005@gmail.com","lastName":"","firstName":""},"workshop_schedule":{"time":"","end_date":null,"raw_date":"maandag 08/09/2025 van 10u00 tot 13u00","start_date":"2025-09-08T09:00:00Z"}}` |
| 6597 | 1/9/2025 | Yone Van Kerkhove | yone.van.kerkhove2005@gmail.com | Perfectie van articulatie | €249.00 | `{"migration_source":"ID348299_voices.sql","participant_info":{"age":"","email":"yone.van.kerkhove2005@gmail.com","userId":12007,"lastName":"Van Kerkhove","firstName":"Yone","experience":"","profession":""},"workshop_schedule":{"time":"","end_date":null,"raw_date":"maandag 08/09/2025 van 10u00 tot 13u00","start_date":"2025-09-08T09:00:00Z"}}` |
| 6597 | 1/9/2025 | Yone Van Kerkhove | yone.van.kerkhove2005@gmail.com | Perfectie van articulatie | €0.00 | `{"migration_source":"ID348299_voices.sql","participant_info":{"email":"yone.van.kerkhove2005@gmail.com","lastName":"","firstName":""},"workshop_schedule":{"time":"","end_date":null,"raw_date":"maandag 08/09/2025 van 10u00 tot 13u00","start_date":"2025-09-08T09:00:00Z"}}` |
| 6597 | 1/9/2025 | Yone Van Kerkhove | yone.van.kerkhove2005@gmail.com | Perfectie van articulatie | €0.00 | `{"migration_source":"ID348299_voices.sql","participant_info":{"email":"yone.van.kerkhove2005@gmail.com","userId":12007,"lastName":"","firstName":""},"workshop_schedule":{"time":"","end_date":null,"raw_date":"maandag 08/09/2025 van 10u00 tot 13u00","start_date":"2025-09-08T09:00:00Z"}}` |
| 6597 | 1/9/2025 | Yone Van Kerkhove | yone.van.kerkhove2005@gmail.com | Perfectie van articulatie | €0.00 | `{"migration_source":"ID348299_voices.sql","participant_info":{"age":"","email":"yone.van.kerkhove2005@gmail.com","userId":12007,"lastName":"Van Kerkhove","firstName":"Yone","experience":"","profession":""},"workshop_schedule":{"time":"","end_date":null,"raw_date":"maandag 08/09/2025 van 10u00 tot 13u00","start_date":"2025-09-08T09:00:00Z"}}` |
| 6596 | 1/9/2025 | Kristel Meerkens | kristel.meerkens@telenet.be | Perfectie van articulatie | €0.00 | `{"migration_source":"ID348299_voices.sql","participant_info":{"age":"","email":"kristel.meerkens@telenet.be","userId":12004,"lastName":"Meerkens","firstName":"Kristel","experience":"","profession":""},"workshop_schedule":{"time":"","end_date":null,"raw_date":"maandag 08/09/2025 van 10u00 tot 13u00","start_date":"2025-09-08T09:00:00Z"}}` |
| 6596 | 1/9/2025 | Kristel Meerkens | kristel.meerkens@telenet.be | Perfectie van articulatie | €0.00 | `{"migration_source":"ID348299_voices.sql","participant_info":{"email":"kristel.meerkens@telenet.be","lastName":"","firstName":""},"workshop_schedule":{"time":"","end_date":null,"raw_date":"maandag 08/09/2025 van 10u00 tot 13u00","start_date":"2025-09-08T09:00:00Z"}}` |
| 6596 | 1/9/2025 | Kristel Meerkens | kristel.meerkens@telenet.be | Perfectie van articulatie | €0.00 | `{"migration_source":"ID348299_voices.sql","participant_info":{"email":"kristel.meerkens@telenet.be","userId":12004,"lastName":"","firstName":""},"workshop_schedule":{"time":"","end_date":null,"raw_date":"maandag 08/09/2025 van 10u00 tot 13u00","start_date":"2025-09-08T09:00:00Z"}}` |
| 6596 | 1/9/2025 | Kristel Meerkens | kristel.meerkens@telenet.be | Perfectie van articulatie | €0.00 | `{"migration_source":"ID348299_voices.sql","participant_info":{"email":"kristel.meerkens@telenet.be","lastName":"","firstName":""},"workshop_schedule":{"time":"","end_date":null,"raw_date":"maandag 08/09/2025 van 10u00 tot 13u00","start_date":"2025-09-08T09:00:00Z"}}` |
| 6596 | 1/9/2025 | Kristel Meerkens | kristel.meerkens@telenet.be | Perfectie van articulatie | €0.00 | `{"migration_source":"ID348299_voices.sql","participant_info":{"email":"kristel.meerkens@telenet.be","lastName":"","firstName":""},"workshop_schedule":{"time":"","end_date":null,"raw_date":"maandag 08/09/2025 van 10u00 tot 13u00","start_date":"2025-09-08T09:00:00Z"}}` |
| 6596 | 1/9/2025 | Kristel Meerkens | kristel.meerkens@telenet.be | Perfectie van articulatie | €249.00 | `{"migration_source":"ID348299_voices.sql","participant_info":{"age":"","email":"kristel.meerkens@telenet.be","userId":12004,"lastName":"Meerkens","firstName":"Kristel","experience":"","profession":""},"workshop_schedule":{"time":"","end_date":null,"raw_date":"maandag 08/09/2025 van 10u00 tot 13u00","start_date":"2025-09-08T09:00:00Z"}}` |
| 6940 | 28/8/2025 | Bart Tirez | bart.tirez@gmail.com | Perfectie van articulatie | €0.00 | `{"migration_source":"ID348299_voices.sql","participant_info":{"age":"","email":"bart.tirez@gmail.com","userId":10231,"lastName":"Tirez","firstName":"Bart","experience":"","profession":""},"workshop_schedule":{"time":"","end_date":null,"raw_date":"woensdag 03/12/2025 van 10u00 tot 13u00","start_date":"2025-12-03T09:00:00Z"}}` |
| 6940 | 28/8/2025 | Bart Tirez | bart.tirez@gmail.com | Perfectie van articulatie | €0.00 | `{"migration_source":"ID348299_voices.sql","participant_info":{"age":"","email":"bart.tirez@gmail.com","userId":10231,"lastName":"Tirez","firstName":"Bart","experience":"","profession":""},"workshop_schedule":{"time":"","end_date":null,"raw_date":"woensdag 03/12/2025 van 10u00 tot 13u00","start_date":"2025-12-03T09:00:00Z"}}` |
| 6940 | 28/8/2025 | Bart Tirez | bart.tirez@gmail.com | Perfectie van articulatie | €0.00 | `{"migration_source":"ID348299_voices.sql","participant_info":{"age":"","email":"bart.tirez@gmail.com","userId":10231,"lastName":"Tirez","firstName":"Bart","experience":"","profession":""},"workshop_schedule":{"time":"","end_date":null,"raw_date":"woensdag 03/12/2025 van 10u00 tot 13u00","start_date":"2025-12-03T09:00:00Z"}}` |
| 6940 | 28/8/2025 | Bart Tirez | bart.tirez@gmail.com | Perfectie van articulatie | €0.00 | `{"migration_source":"ID348299_voices.sql","participant_info":{"age":"","email":"bart.tirez@gmail.com","userId":10231,"lastName":"Tirez","firstName":"Bart","experience":"","profession":""},"workshop_schedule":{"time":"","end_date":null,"raw_date":"woensdag 03/12/2025 van 10u00 tot 13u00","start_date":"2025-12-03T09:00:00Z"}}` |
| 6940 | 28/8/2025 | Bart Tirez | bart.tirez@gmail.com | Perfectie van articulatie | €0.00 | `{"migration_source":"ID348299_voices.sql","participant_info":{"age":"","email":"bart.tirez@gmail.com","userId":10231,"lastName":"","firstName":"","experience":"","profession":""},"workshop_schedule":{"time":"","end_date":null,"raw_date":"woensdag 03/12/2025 van 10u00 tot 13u00","start_date":"2025-12-03T09:00:00Z"}}` |
| 6939 | 28/8/2025 | Bart Tirez | bart.tirez@gmail.com | Perfectie van intonatie | €0.00 | `{"migration_source":"ID348299_voices.sql","participant_info":{"email":"bart.tirez@gmail.com","lastName":"","firstName":""},"workshop_schedule":{"time":"","end_date":null,"raw_date":"woensdag 03/12/2025 van 14u00 tot 17u00","start_date":"2025-12-03T09:00:00Z"}}` |
| 6939 | 28/8/2025 | Bart Tirez | bart.tirez@gmail.com | Perfectie van intonatie | €0.00 | `{"migration_source":"ID348299_voices.sql","participant_info":{"age":"","email":"bart.tirez@gmail.com","userId":10231,"lastName":"Tirez","firstName":"Bart","experience":"","profession":""},"workshop_schedule":{"time":"","end_date":null,"raw_date":"woensdag 03/12/2025 van 14u00 tot 17u00","start_date":"2025-12-03T09:00:00Z"}}` |
| 6939 | 28/8/2025 | Bart Tirez | bart.tirez@gmail.com | Perfectie van intonatie | €0.00 | `{"migration_source":"ID348299_voices.sql","participant_info":{"email":"bart.tirez@gmail.com","lastName":"","firstName":""},"workshop_schedule":{"time":"","end_date":null,"raw_date":"woensdag 03/12/2025 van 14u00 tot 17u00","start_date":"2025-12-03T09:00:00Z"}}` |
| 6939 | 28/8/2025 | Bart Tirez | bart.tirez@gmail.com | Perfectie van intonatie | €0.00 | `{"migration_source":"ID348299_voices.sql","participant_info":{"email":"bart.tirez@gmail.com","lastName":"","firstName":""},"workshop_schedule":{"time":"","end_date":null,"raw_date":"woensdag 03/12/2025 van 14u00 tot 17u00","start_date":"2025-12-03T09:00:00Z"}}` |
| 6939 | 28/8/2025 | Bart Tirez | bart.tirez@gmail.com | Perfectie van intonatie | €0.00 | `{"migration_source":"ID348299_voices.sql","participant_info":{"email":"bart.tirez@gmail.com","userId":10231,"lastName":"","firstName":""},"workshop_schedule":{"time":"","end_date":null,"raw_date":"woensdag 03/12/2025 van 14u00 tot 17u00","start_date":"2025-12-03T09:00:00Z"}}` |
| 6555 | 23/7/2025 | Lenaart T’jollyn | l.tjollyn@outlook.com | Voice-overs voor beginners | €499.00 | `{"migration_source":"ID348299_voices.sql","participant_info":{"age":"","email":"l.tjollyn@outlook.com","userId":10364,"lastName":"T’jollyn","firstName":"Lenaart","experience":"","profession":""},"workshop_schedule":{"time":"","end_date":null,"raw_date":"vrijdag 19/09/2025 van 10u00 tot 17u00","start_date":"2025-09-19T09:00:00Z"}}` |
| 6555 | 23/7/2025 | Lenaart T’jollyn | l.tjollyn@outlook.com | Voice-overs voor beginners | €0.00 | `{"migration_source":"ID348299_voices.sql","participant_info":{"email":"l.tjollyn@outlook.com","userId":10364,"lastName":"","firstName":""},"workshop_schedule":{"time":"","end_date":null,"raw_date":"vrijdag 19/09/2025 van 10u00 tot 17u00","start_date":"2025-09-19T09:00:00Z"}}` |
| 6555 | 23/7/2025 | Lenaart T’jollyn | l.tjollyn@outlook.com | Voice-overs voor beginners | €0.00 | `{"migration_source":"ID348299_voices.sql","participant_info":{"email":"l.tjollyn@outlook.com","lastName":"","firstName":""},"workshop_schedule":{"time":"","end_date":null,"raw_date":"vrijdag 19/09/2025 van 10u00 tot 17u00","start_date":"2025-09-19T09:00:00Z"}}` |
| 6555 | 23/7/2025 | Lenaart T’jollyn | l.tjollyn@outlook.com | Voice-overs voor beginners | €0.00 | `{"migration_source":"ID348299_voices.sql","participant_info":{"email":"l.tjollyn@outlook.com","lastName":"","firstName":""},"workshop_schedule":{"time":"","end_date":null,"raw_date":"vrijdag 19/09/2025 van 10u00 tot 17u00","start_date":"2025-09-19T09:00:00Z"}}` |
| 6555 | 23/7/2025 | Lenaart T’jollyn | l.tjollyn@outlook.com | Voice-overs voor beginners | €0.00 | `{"migration_source":"ID348299_voices.sql","participant_info":{"email":"l.tjollyn@outlook.com","lastName":"","firstName":""},"workshop_schedule":{"time":"","end_date":null,"raw_date":"vrijdag 19/09/2025 van 10u00 tot 17u00","start_date":"2025-09-19T09:00:00Z"}}` |
| 6555 | 23/7/2025 | Lenaart T’jollyn | l.tjollyn@outlook.com | Voice-overs voor beginners | €0.00 | `{"migration_source":"ID348299_voices.sql","participant_info":{"age":"","email":"l.tjollyn@outlook.com","userId":10364,"lastName":"T’jollyn","firstName":"Lenaart","experience":"","profession":""},"workshop_schedule":{"time":"","end_date":null,"raw_date":"vrijdag 19/09/2025 van 10u00 tot 17u00","start_date":"2025-09-19T09:00:00Z"}}` |
| 6938 | 23/7/2025 | Lenaart T’jollyn | l.tjollyn@outlook.com | Documentaires inspreken | €0.00 | `{"migration_source":"ID348299_voices.sql","participant_info":{"email":"l.tjollyn@outlook.com","lastName":"","firstName":""},"workshop_schedule":{"time":"","end_date":null,"raw_date":"zaterdag 18/10/2025 van 10u tot 17u","start_date":"2025-10-18T09:00:00Z"}}` |
| 6938 | 23/7/2025 | Lenaart T’jollyn | l.tjollyn@outlook.com | Documentaires inspreken | €0.00 | `{"migration_source":"ID348299_voices.sql","participant_info":{"email":"l.tjollyn@outlook.com","lastName":"","firstName":""},"workshop_schedule":{"time":"","end_date":null,"raw_date":"zaterdag 18/10/2025 van 10u tot 17u","start_date":"2025-10-18T09:00:00Z"}}` |
| 6938 | 23/7/2025 | Lenaart T’jollyn | l.tjollyn@outlook.com | Documentaires inspreken | €0.00 | `{"migration_source":"ID348299_voices.sql","participant_info":{"email":"l.tjollyn@outlook.com","userId":10364,"lastName":"","firstName":""},"workshop_schedule":{"time":"","end_date":null,"raw_date":"zaterdag 18/10/2025 van 10u tot 17u","start_date":"2025-10-18T09:00:00Z"}}` |
| 6938 | 23/7/2025 | Lenaart T’jollyn | l.tjollyn@outlook.com | Documentaires inspreken | €0.00 | `{"migration_source":"ID348299_voices.sql","participant_info":{"email":"l.tjollyn@outlook.com","lastName":"","firstName":""},"workshop_schedule":{"time":"","end_date":null,"raw_date":"zaterdag 18/10/2025 van 10u tot 17u","start_date":"2025-10-18T09:00:00Z"}}` |
| 6938 | 23/7/2025 | Lenaart T’jollyn | l.tjollyn@outlook.com | Documentaires inspreken | €0.00 | `{"migration_source":"ID348299_voices.sql","participant_info":{"age":"","email":"l.tjollyn@outlook.com","userId":10364,"lastName":"T’jollyn","firstName":"Lenaart","experience":"","profession":""},"workshop_schedule":{"time":"","end_date":null,"raw_date":"zaterdag 18/10/2025 van 10u tot 17u","start_date":"2025-10-18T09:00:00Z"}}` |
| 6491 | 16/6/2025 | Saloua El Moussaoui | saloua.elmoussaoui@antwerpen.be | Perfectie van articulatie | €0.00 | `{"migration_source":"ID348299_voices.sql","participant_info":{"email":"saloua.elmoussaoui@antwerpen.be","lastName":"","firstName":""},"workshop_schedule":{"time":"","end_date":null,"raw_date":"maandag 08/09/2025 van 10u00 tot 13u00","start_date":"2025-09-08T09:00:00Z"}}` |
| 6491 | 16/6/2025 | Saloua El Moussaoui | saloua.elmoussaoui@antwerpen.be | Perfectie van articulatie | €0.00 | `{"migration_source":"ID348299_voices.sql","participant_info":{"email":"saloua.elmoussaoui@antwerpen.be","lastName":"","firstName":""},"workshop_schedule":{"time":"","end_date":null,"raw_date":"maandag 08/09/2025 van 10u00 tot 13u00","start_date":"2025-09-08T09:00:00Z"}}` |
| 6491 | 16/6/2025 | Saloua El Moussaoui | saloua.elmoussaoui@antwerpen.be | Perfectie van articulatie | €0.00 | `{"migration_source":"ID348299_voices.sql","participant_info":{"email":"saloua.elmoussaoui@antwerpen.be","lastName":"","firstName":""},"workshop_schedule":{"time":"","end_date":null,"raw_date":"maandag 08/09/2025 van 10u00 tot 13u00","start_date":"2025-09-08T09:00:00Z"}}` |
| 6491 | 16/6/2025 | Saloua El Moussaoui | saloua.elmoussaoui@antwerpen.be | Perfectie van articulatie | €249.00 | `{"migration_source":"ID348299_voices.sql","participant_info":{"age":"","email":"saloua.elmoussaoui@antwerpen.be","userId":10458,"lastName":"El Moussaoui","firstName":"Saloua","experience":"","profession":""},"workshop_schedule":{"time":"","end_date":null,"raw_date":"maandag 08/09/2025 van 10u00 tot 13u00","start_date":"2025-09-08T09:00:00Z"}}` |
| 6491 | 16/6/2025 | Saloua El Moussaoui | saloua.elmoussaoui@antwerpen.be | Perfectie van articulatie | €0.00 | `{"migration_source":"ID348299_voices.sql","participant_info":{"email":"saloua.elmoussaoui@antwerpen.be","userId":10458,"lastName":"","firstName":""},"workshop_schedule":{"time":"","end_date":null,"raw_date":"maandag 08/09/2025 van 10u00 tot 13u00","start_date":"2025-09-08T09:00:00Z"}}` |
| 6491 | 16/6/2025 | Saloua El Moussaoui | saloua.elmoussaoui@antwerpen.be | Perfectie van articulatie | €0.00 | `{"migration_source":"ID348299_voices.sql","participant_info":{"age":"","email":"saloua.elmoussaoui@antwerpen.be","userId":10458,"lastName":"El Moussaoui","firstName":"Saloua","experience":"","profession":""},"workshop_schedule":{"time":"","end_date":null,"raw_date":"maandag 08/09/2025 van 10u00 tot 13u00","start_date":"2025-09-08T09:00:00Z"}}` |
| 6489 | 15/6/2025 | Nils Vandenweghe | nils.vandenweghe@gmail.com | Perfectie van intonatie | €0.00 | `{"migration_source":"ID348299_voices.sql","participant_info":{"email":"nils.vandenweghe@gmail.com","lastName":"","firstName":""},"workshop_schedule":{"time":"","end_date":null,"raw_date":"dinsdag 11/11/2025 van 09u00 tot 12u00","start_date":"2025-11-11T09:00:00Z"}}` |
| 6489 | 15/6/2025 | Nils Vandenweghe | nils.vandenweghe@gmail.com | Perfectie van intonatie | €0.00 | `{"migration_source":"ID348299_voices.sql","participant_info":{"email":"nils.vandenweghe@gmail.com","userId":10600,"lastName":"","firstName":""},"workshop_schedule":{"time":"","end_date":null,"raw_date":"dinsdag 11/11/2025 van 09u00 tot 12u00","start_date":"2025-11-11T09:00:00Z"}}` |
| 6489 | 15/6/2025 | Nils Vandenweghe | nils.vandenweghe@gmail.com | Perfectie van intonatie | €0.00 | `{"migration_source":"ID348299_voices.sql","participant_info":{"email":"nils.vandenweghe@gmail.com","lastName":"","firstName":""},"workshop_schedule":{"time":"","end_date":null,"raw_date":"dinsdag 11/11/2025 van 09u00 tot 12u00","start_date":"2025-11-11T09:00:00Z"}}` |
| 6489 | 15/6/2025 | Nils Vandenweghe | nils.vandenweghe@gmail.com | Perfectie van intonatie | €249.00 | `{"migration_source":"ID348299_voices.sql","participant_info":{"age":"","email":"nils.vandenweghe@gmail.com","userId":10600,"lastName":"Vandenweghe","firstName":"Nils","experience":"","profession":""},"workshop_schedule":{"time":"","end_date":null,"raw_date":"dinsdag 11/11/2025 van 09u00 tot 12u00","start_date":"2025-11-11T09:00:00Z"}}` |
| 6489 | 15/6/2025 | Nils Vandenweghe | nils.vandenweghe@gmail.com | Perfectie van intonatie | €0.00 | `{"migration_source":"ID348299_voices.sql","participant_info":{"email":"nils.vandenweghe@gmail.com","lastName":"","firstName":""},"workshop_schedule":{"time":"","end_date":null,"raw_date":"dinsdag 11/11/2025 van 09u00 tot 12u00","start_date":"2025-11-11T09:00:00Z"}}` |
| 6489 | 15/6/2025 | Nils Vandenweghe | nils.vandenweghe@gmail.com | Perfectie van intonatie | €0.00 | `{"migration_source":"ID348299_voices.sql","participant_info":{"email":"nils.vandenweghe@gmail.com","lastName":"","firstName":""},"workshop_schedule":{"time":"","end_date":null,"raw_date":"dinsdag 11/11/2025 van 09u00 tot 12u00","start_date":"2025-11-11T09:00:00Z"}}` |
| 6488 | 14/6/2025 | Inge Vandeurzen | inge.vandeurzen@ivconsultbv.com | Perfectie van articulatie | €0.00 | `{"migration_source":"ID348299_voices.sql","participant_info":{"email":"inge.vandeurzen@ivconsultbv.com","lastName":"","firstName":""},"workshop_schedule":{"time":"","end_date":null,"raw_date":"donderdag 09/10/2025 van 10u00 tot 13u00","start_date":"2025-10-09T09:00:00Z"}}` |
| 6488 | 14/6/2025 | Inge Vandeurzen | inge.vandeurzen@ivconsultbv.com | Perfectie van articulatie | €0.00 | `{"migration_source":"ID348299_voices.sql","participant_info":{"email":"inge.vandeurzen@ivconsultbv.com","lastName":"","firstName":""},"workshop_schedule":{"time":"","end_date":null,"raw_date":"donderdag 09/10/2025 van 10u00 tot 13u00","start_date":"2025-10-09T09:00:00Z"}}` |
| 6488 | 14/6/2025 | Inge Vandeurzen | inge.vandeurzen@ivconsultbv.com | Perfectie van articulatie | €249.00 | `{"migration_source":"ID348299_voices.sql","participant_info":{"age":"","email":"inge.vandeurzen@ivconsultbv.com","userId":11918,"lastName":"Vandeurzen","firstName":"Inge","experience":"","profession":""},"workshop_schedule":{"time":"","end_date":null,"raw_date":"donderdag 09/10/2025 van 10u00 tot 13u00","start_date":"2025-10-09T09:00:00Z"}}` |
| 6488 | 14/6/2025 | Inge Vandeurzen | inge.vandeurzen@ivconsultbv.com | Perfectie van articulatie | €0.00 | `{"migration_source":"ID348299_voices.sql","participant_info":{"email":"inge.vandeurzen@ivconsultbv.com","lastName":"","firstName":""},"workshop_schedule":{"time":"","end_date":null,"raw_date":"donderdag 09/10/2025 van 10u00 tot 13u00","start_date":"2025-10-09T09:00:00Z"}}` |
| 6488 | 14/6/2025 | Inge Vandeurzen | inge.vandeurzen@ivconsultbv.com | Perfectie van articulatie | €0.00 | `{"migration_source":"ID348299_voices.sql","participant_info":{"email":"inge.vandeurzen@ivconsultbv.com","userId":11918,"lastName":"","firstName":""},"workshop_schedule":{"time":"","end_date":null,"raw_date":"donderdag 09/10/2025 van 10u00 tot 13u00","start_date":"2025-10-09T09:00:00Z"}}` |
| 6488 | 14/6/2025 | Inge Vandeurzen | inge.vandeurzen@ivconsultbv.com | Perfectie van articulatie | €0.00 | `{"migration_source":"ID348299_voices.sql","participant_info":{"email":"inge.vandeurzen@ivconsultbv.com","lastName":"","firstName":""},"workshop_schedule":{"time":"","end_date":null,"raw_date":"donderdag 09/10/2025 van 10u00 tot 13u00","start_date":"2025-10-09T09:00:00Z"}}` |
| 6487 | 14/6/2025 | Inge Vandeurzen | inge.vandeurzen@ivconsultbv.com | Verwen je stem! | €0.00 | `{"migration_source":"ID348299_voices.sql","participant_info":{"email":"inge.vandeurzen@ivconsultbv.com","lastName":"","firstName":""},"workshop_schedule":{"time":"","end_date":null,"raw_date":"woensdag 12/11/2025 van 10u00 tot 13u00","start_date":"2025-11-12T09:00:00Z"}}` |
| 6487 | 14/6/2025 | Inge Vandeurzen | inge.vandeurzen@ivconsultbv.com | Verwen je stem! | €0.00 | `{"migration_source":"ID348299_voices.sql","participant_info":{"email":"inge.vandeurzen@ivconsultbv.com","userId":11918,"lastName":"","firstName":""},"workshop_schedule":{"time":"","end_date":null,"raw_date":"woensdag 12/11/2025 van 10u00 tot 13u00","start_date":"2025-11-12T09:00:00Z"}}` |
| 6487 | 14/6/2025 | Inge Vandeurzen | inge.vandeurzen@ivconsultbv.com | Verwen je stem! | €0.00 | `{"migration_source":"ID348299_voices.sql","participant_info":{"email":"inge.vandeurzen@ivconsultbv.com","lastName":"","firstName":""},"workshop_schedule":{"time":"","end_date":null,"raw_date":"woensdag 12/11/2025 van 10u00 tot 13u00","start_date":"2025-11-12T09:00:00Z"}}` |
| 6487 | 14/6/2025 | Inge Vandeurzen | inge.vandeurzen@ivconsultbv.com | Verwen je stem! | €0.00 | `{"migration_source":"ID348299_voices.sql","participant_info":{"email":"inge.vandeurzen@ivconsultbv.com","lastName":"","firstName":""},"workshop_schedule":{"time":"","end_date":null,"raw_date":"woensdag 12/11/2025 van 10u00 tot 13u00","start_date":"2025-11-12T09:00:00Z"}}` |
| 6487 | 14/6/2025 | Inge Vandeurzen | inge.vandeurzen@ivconsultbv.com | Verwen je stem! | €0.00 | `{"migration_source":"ID348299_voices.sql","participant_info":{"email":"inge.vandeurzen@ivconsultbv.com","lastName":"","firstName":""},"workshop_schedule":{"time":"","end_date":null,"raw_date":"woensdag 12/11/2025 van 10u00 tot 13u00","start_date":"2025-11-12T09:00:00Z"}}` |
| 6487 | 14/6/2025 | Inge Vandeurzen | inge.vandeurzen@ivconsultbv.com | Verwen je stem! | €249.00 | `{"migration_source":"ID348299_voices.sql","participant_info":{"age":"","email":"inge.vandeurzen@ivconsultbv.com","userId":11918,"lastName":"Vandeurzen","firstName":"Inge","experience":"","profession":""},"workshop_schedule":{"time":"","end_date":null,"raw_date":"woensdag 12/11/2025 van 10u00 tot 13u00","start_date":"2025-11-12T09:00:00Z"}}` |
| 6937 | 14/6/2025 | Inge Vandeurzen | inge.vandeurzen@ivconsultbv.com | Verwen je stem! | €0.00 | `{"migration_source":"ID348299_voices.sql","participant_info":{"age":"","email":"inge.vandeurzen@ivconsultbv.com","userId":11918,"lastName":"Vandeurzen","firstName":"Inge","experience":"","profession":""},"workshop_schedule":{"time":"","end_date":null,"raw_date":"dinsdag 09/09/2025 van 10u00 tot 13u00","start_date":"2025-09-09T09:00:00Z"}}` |
| 6937 | 14/6/2025 | Inge Vandeurzen | inge.vandeurzen@ivconsultbv.com | Verwen je stem! | €0.00 | `{"migration_source":"ID348299_voices.sql","participant_info":{"email":"inge.vandeurzen@ivconsultbv.com","lastName":"","firstName":""},"workshop_schedule":{"time":"","end_date":null,"raw_date":"dinsdag 09/09/2025 van 10u00 tot 13u00","start_date":"2025-09-09T09:00:00Z"}}` |
| 6937 | 14/6/2025 | Inge Vandeurzen | inge.vandeurzen@ivconsultbv.com | Verwen je stem! | €0.00 | `{"migration_source":"ID348299_voices.sql","participant_info":{"email":"inge.vandeurzen@ivconsultbv.com","lastName":"","firstName":""},"workshop_schedule":{"time":"","end_date":null,"raw_date":"dinsdag 09/09/2025 van 10u00 tot 13u00","start_date":"2025-09-09T09:00:00Z"}}` |
| 6937 | 14/6/2025 | Inge Vandeurzen | inge.vandeurzen@ivconsultbv.com | Verwen je stem! | €0.00 | `{"migration_source":"ID348299_voices.sql","participant_info":{"email":"inge.vandeurzen@ivconsultbv.com","userId":11918,"lastName":"","firstName":""},"workshop_schedule":{"time":"","end_date":null,"raw_date":"dinsdag 09/09/2025 van 10u00 tot 13u00","start_date":"2025-09-09T09:00:00Z"}}` |
| 6937 | 14/6/2025 | Inge Vandeurzen | inge.vandeurzen@ivconsultbv.com | Verwen je stem! | €0.00 | `{"migration_source":"ID348299_voices.sql","participant_info":{"age":"","email":"inge.vandeurzen@ivconsultbv.com","userId":11918,"lastName":"Vandeurzen","firstName":"Inge","experience":"","profession":""},"workshop_schedule":{"time":"","end_date":null,"raw_date":"dinsdag 09/09/2025 van 10u00 tot 13u00","start_date":"2025-09-09T09:00:00Z"}}` |
| 6482 | 11/6/2025 | Evelyne Benbassat | evelyne.benbassat@hotmail.com | Perfectie van intonatie | €0.00 | `{"migration_source":"ID348299_voices.sql","participant_info":{"age":"","email":"evelyne.benbassat@hotmail.com","userId":11913,"lastName":"Benbassat","firstName":"Evelyne","experience":"","profession":""},"workshop_schedule":{"time":"","end_date":null,"raw_date":"08/09/2025 van 14u00 tot 17u00","start_date":"2025-09-08T09:00:00Z"}}` |
| 6482 | 11/6/2025 | Evelyne Benbassat | evelyne.benbassat@hotmail.com | Perfectie van intonatie | €249.00 | `{"migration_source":"ID348299_voices.sql","participant_info":{"age":"","email":"evelyne.benbassat@hotmail.com","userId":11913,"lastName":"Benbassat","firstName":"Evelyne","experience":"","profession":""},"workshop_schedule":{"time":"","end_date":null,"raw_date":"08/09/2025 van 14u00 tot 17u00","start_date":"2025-09-08T09:00:00Z"}}` |
| 6482 | 11/6/2025 | Evelyne Benbassat | evelyne.benbassat@hotmail.com | Perfectie van intonatie | €0.00 | `{"migration_source":"ID348299_voices.sql","participant_info":{"email":"evelyne.benbassat@hotmail.com","userId":11913,"lastName":"","firstName":""},"workshop_schedule":{"time":"","end_date":null,"raw_date":"08/09/2025 van 14u00 tot 17u00","start_date":"2025-09-08T09:00:00Z"}}` |
| 6482 | 11/6/2025 | Evelyne Benbassat | evelyne.benbassat@hotmail.com | Perfectie van intonatie | €0.00 | `{"migration_source":"ID348299_voices.sql","participant_info":{"email":"evelyne.benbassat@hotmail.com","lastName":"","firstName":""},"workshop_schedule":{"time":"","end_date":null,"raw_date":"08/09/2025 van 14u00 tot 17u00","start_date":"2025-09-08T09:00:00Z"}}` |
| 6482 | 11/6/2025 | Evelyne Benbassat | evelyne.benbassat@hotmail.com | Perfectie van intonatie | €0.00 | `{"migration_source":"ID348299_voices.sql","participant_info":{"email":"evelyne.benbassat@hotmail.com","lastName":"","firstName":""},"workshop_schedule":{"time":"","end_date":null,"raw_date":"08/09/2025 van 14u00 tot 17u00","start_date":"2025-09-08T09:00:00Z"}}` |
| 6482 | 11/6/2025 | Evelyne Benbassat | evelyne.benbassat@hotmail.com | Perfectie van intonatie | €0.00 | `{"migration_source":"ID348299_voices.sql","participant_info":{"email":"evelyne.benbassat@hotmail.com","lastName":"","firstName":""},"workshop_schedule":{"time":"","end_date":null,"raw_date":"08/09/2025 van 14u00 tot 17u00","start_date":"2025-09-08T09:00:00Z"}}` |
| 6465 | 3/6/2025 | Kobe De Wouw | kobedewouw@gmail.com | Audioboeken inspreken | €150.00 | `{"migration_source":"ID348299_voices.sql","participant_info":{"age":"","email":"kobedewouw@gmail.com","userId":1939,"lastName":"De Wouw","firstName":"Kobe","experience":"","profession":""},"workshop_schedule":{"time":"","end_date":null,"raw_date":"02/06/2025 van 14u00 tot 17u00","start_date":"2025-06-02T09:00:00Z"}}` |
| 6459 | 27/5/2025 | Lisa De Greef | lisa.de.greef@me.com | Perfectie van articulatie | €0.00 | `{"migration_source":"ID348299_voices.sql","participant_info":{"email":"lisa.de.greef@me.com","lastName":"","firstName":""},"workshop_schedule":{"time":"","end_date":null,"raw_date":"donderdag 09/10/2025 van 10u00 tot 13u00","start_date":"2025-10-09T09:00:00Z"}}` |
| 6459 | 27/5/2025 | Lisa De Greef | lisa.de.greef@me.com | Perfectie van articulatie | €0.00 | `{"migration_source":"ID348299_voices.sql","participant_info":{"email":"lisa.de.greef@me.com","userId":10717,"lastName":"","firstName":""},"workshop_schedule":{"time":"","end_date":null,"raw_date":"donderdag 09/10/2025 van 10u00 tot 13u00","start_date":"2025-10-09T09:00:00Z"}}` |
| 6459 | 27/5/2025 | Lisa De Greef | lisa.de.greef@me.com | Perfectie van articulatie | €254.28 | `{"migration_source":"ID348299_voices.sql","participant_info":{"age":"","email":"lisa.de.greef@me.com","userId":10717,"lastName":"De Greef","firstName":"Lisa","experience":"","profession":""},"workshop_schedule":{"time":"","end_date":null,"raw_date":"donderdag 09/10/2025 van 10u00 tot 13u00","start_date":"2025-10-09T09:00:00Z"}}` |
| 6459 | 27/5/2025 | Lisa De Greef | lisa.de.greef@me.com | Perfectie van articulatie | €0.00 | `{"migration_source":"ID348299_voices.sql","participant_info":{"email":"lisa.de.greef@me.com","lastName":"","firstName":""},"workshop_schedule":{"time":"","end_date":null,"raw_date":"donderdag 09/10/2025 van 10u00 tot 13u00","start_date":"2025-10-09T09:00:00Z"}}` |
| 6459 | 27/5/2025 | Lisa De Greef | lisa.de.greef@me.com | Perfectie van articulatie | €0.00 | `{"migration_source":"ID348299_voices.sql","participant_info":{"email":"lisa.de.greef@me.com","lastName":"","firstName":""},"workshop_schedule":{"time":"","end_date":null,"raw_date":"donderdag 09/10/2025 van 10u00 tot 13u00","start_date":"2025-10-09T09:00:00Z"}}` |
| 6459 | 27/5/2025 | Lisa De Greef | lisa.de.greef@me.com | Perfectie van articulatie | €0.00 | `{"migration_source":"ID348299_voices.sql","participant_info":{"age":"","email":"lisa.de.greef@me.com","userId":10717,"lastName":"De Greef","firstName":"Lisa","experience":"","profession":""},"workshop_schedule":{"time":"","end_date":null,"raw_date":"donderdag 09/10/2025 van 10u00 tot 13u00","start_date":"2025-10-09T09:00:00Z"}}` |
| 6449 | 20/5/2025 | Kobe De Wouw | kobedewouw@gmail.com | Audioboeken inspreken | €0.00 | `{"migration_source":"ID348299_voices.sql","participant_info":{"email":"kobedewouw@gmail.com","lastName":"","firstName":""},"workshop_schedule":{"time":"","end_date":null,"raw_date":"02/06/2025 van 10u00 tot 14u00","start_date":"2025-06-02T09:00:00Z"}}` |
| 6449 | 20/5/2025 | Kobe De Wouw | kobedewouw@gmail.com | Audioboeken inspreken | €0.00 | `{"migration_source":"ID348299_voices.sql","participant_info":{"age":"36","email":"kobedewouw@gmail.com","userId":1939,"lastName":"Van Wouwe","firstName":"Kobe","experience":"","profession":"zelfstandige"},"workshop_schedule":{"time":"","end_date":null,"raw_date":"02/06/2025 van 10u00 tot 14u00","start_date":"2025-06-02T09:00:00Z"}}` |
| 6449 | 20/5/2025 | Kobe De Wouw | kobedewouw@gmail.com | Audioboeken inspreken | €349.00 | `{"migration_source":"ID348299_voices.sql","participant_info":{"age":"36","email":"kobedewouw@gmail.com","userId":1939,"lastName":"Van Wouwe","firstName":"Kobe","experience":"","profession":"zelfstandige"},"workshop_schedule":{"time":"","end_date":null,"raw_date":"02/06/2025 van 10u00 tot 14u00","start_date":"2025-06-02T09:00:00Z"}}` |
| 6449 | 20/5/2025 | Kobe De Wouw | kobedewouw@gmail.com | Audioboeken inspreken | €0.00 | `{"migration_source":"ID348299_voices.sql","participant_info":{"email":"kobedewouw@gmail.com","lastName":"","firstName":""},"workshop_schedule":{"time":"","end_date":null,"raw_date":"02/06/2025 van 10u00 tot 14u00","start_date":"2025-06-02T09:00:00Z"}}` |
| 6449 | 20/5/2025 | Kobe De Wouw | kobedewouw@gmail.com | Audioboeken inspreken | €0.00 | `{"migration_source":"ID348299_voices.sql","participant_info":{"email":"kobedewouw@gmail.com","lastName":"","firstName":""},"workshop_schedule":{"time":"","end_date":null,"raw_date":"02/06/2025 van 10u00 tot 14u00","start_date":"2025-06-02T09:00:00Z"}}` |
| 6449 | 20/5/2025 | Kobe De Wouw | kobedewouw@gmail.com | Audioboeken inspreken | €0.00 | `{"migration_source":"ID348299_voices.sql","participant_info":{"email":"kobedewouw@gmail.com","userId":1939,"lastName":"","firstName":""},"workshop_schedule":{"time":"","end_date":null,"raw_date":"02/06/2025 van 10u00 tot 14u00","start_date":"2025-06-02T09:00:00Z"}}` |
| 6438 | 15/5/2025 | Kiara Vervliet | v_kiara@hotmail.com | Audioboeken inspreken | €0.00 | `{"migration_source":"ID348299_voices.sql","participant_info":{"email":"v_kiara@hotmail.com","lastName":"","firstName":""},"workshop_schedule":{"time":"","end_date":null,"raw_date":"02/06/2025 van 10u00 tot 17u00","start_date":"2025-06-02T09:00:00Z"}}` |
| 6438 | 15/5/2025 | Kiara Vervliet | v_kiara@hotmail.com | Audioboeken inspreken | €0.00 | `{"migration_source":"ID348299_voices.sql","participant_info":{"email":"v_kiara@hotmail.com","lastName":"","firstName":""},"workshop_schedule":{"time":"","end_date":null,"raw_date":"02/06/2025 van 10u00 tot 17u00","start_date":"2025-06-02T09:00:00Z"}}` |
| 6438 | 15/5/2025 | Kiara Vervliet | v_kiara@hotmail.com | Audioboeken inspreken | €0.00 | `{"migration_source":"ID348299_voices.sql","participant_info":{"age":"27","email":"v_kiara@hotmail.com","userId":11185,"lastName":"Vervliet","firstName":"Kiara","experience":"","profession":"Redacteur Radio2"},"workshop_schedule":{"time":"","end_date":null,"raw_date":"02/06/2025 van 10u00 tot 17u00","start_date":"2025-06-02T09:00:00Z"}}` |
| 6438 | 15/5/2025 | Kiara Vervliet | v_kiara@hotmail.com | Audioboeken inspreken | €0.00 | `{"migration_source":"ID348299_voices.sql","participant_info":{"email":"v_kiara@hotmail.com","userId":11185,"lastName":"","firstName":""},"workshop_schedule":{"time":"","end_date":null,"raw_date":"02/06/2025 van 10u00 tot 17u00","start_date":"2025-06-02T09:00:00Z"}}` |
| 6438 | 15/5/2025 | Kiara Vervliet | v_kiara@hotmail.com | Audioboeken inspreken | €499.00 | `{"migration_source":"ID348299_voices.sql","participant_info":{"age":"27","email":"v_kiara@hotmail.com","userId":11185,"lastName":"Vervliet","firstName":"Kiara","experience":"","profession":"Redacteur Radio2"},"workshop_schedule":{"time":"","end_date":null,"raw_date":"02/06/2025 van 10u00 tot 17u00","start_date":"2025-06-02T09:00:00Z"}}` |
| 6438 | 15/5/2025 | Kiara Vervliet | v_kiara@hotmail.com | Audioboeken inspreken | €0.00 | `{"migration_source":"ID348299_voices.sql","participant_info":{"email":"v_kiara@hotmail.com","lastName":"","firstName":""},"workshop_schedule":{"time":"","end_date":null,"raw_date":"02/06/2025 van 10u00 tot 17u00","start_date":"2025-06-02T09:00:00Z"}}` |
| 6435 | 10/5/2025 | Petra Robben | petra.robben@telenet.be | Voice-overs voor beginners | €314.10 | `{"migration_source":"ID348299_voices.sql","participant_info":{"age":"54","email":"petra.robben@telenet.be","userId":10782,"lastName":"Robben","firstName":"Petra","experience":"","profession":"leerkracht + beleidsmedewerker"},"workshop_schedule":{"time":"","end_date":null,"raw_date":"06/06/2025 van 10u00 tot 14u00","start_date":"2025-06-06T09:00:00Z"}}` |
| 6435 | 10/5/2025 | Petra Robben | petra.robben@telenet.be | Voice-overs voor beginners | €0.00 | `{"migration_source":"ID348299_voices.sql","participant_info":{"age":"54","email":"petra.robben@telenet.be","userId":10782,"lastName":"Robben","firstName":"Petra","experience":"","profession":"leerkracht + beleidsmedewerker"},"workshop_schedule":{"time":"","end_date":null,"raw_date":"06/06/2025 van 10u00 tot 14u00","start_date":"2025-06-06T09:00:00Z"}}` |
| 6435 | 10/5/2025 | Petra Robben | petra.robben@telenet.be | Voice-overs voor beginners | €0.00 | `{"migration_source":"ID348299_voices.sql","participant_info":{"email":"petra.robben@telenet.be","lastName":"","firstName":""},"workshop_schedule":{"time":"","end_date":null,"raw_date":"06/06/2025 van 10u00 tot 14u00","start_date":"2025-06-06T09:00:00Z"}}` |
| 6435 | 10/5/2025 | Petra Robben | petra.robben@telenet.be | Voice-overs voor beginners | €0.00 | `{"migration_source":"ID348299_voices.sql","participant_info":{"email":"petra.robben@telenet.be","lastName":"","firstName":""},"workshop_schedule":{"time":"","end_date":null,"raw_date":"06/06/2025 van 10u00 tot 14u00","start_date":"2025-06-06T09:00:00Z"}}` |
| 6435 | 10/5/2025 | Petra Robben | petra.robben@telenet.be | Voice-overs voor beginners | €0.00 | `{"migration_source":"ID348299_voices.sql","participant_info":{"email":"petra.robben@telenet.be","userId":10782,"lastName":"","firstName":""},"workshop_schedule":{"time":"","end_date":null,"raw_date":"06/06/2025 van 10u00 tot 14u00","start_date":"2025-06-06T09:00:00Z"}}` |
| 6435 | 10/5/2025 | Petra Robben | petra.robben@telenet.be | Voice-overs voor beginners | €0.00 | `{"migration_source":"ID348299_voices.sql","participant_info":{"age":"54","email":"petra.robben@telenet.be","userId":10782,"lastName":"Robben","firstName":"Petra","experience":"","profession":"leerkracht + beleidsmedewerker"},"workshop_schedule":{"time":"","end_date":null,"raw_date":"06/06/2025 van 10u00 tot 14u00","start_date":"2025-06-06T09:00:00Z"}}` |
| 6426 | 5/5/2025 | Livia Vande Walle | info@oorhart.be | Voice-overs voor beginners | €0.00 | `{"migration_source":"ID348299_voices.sql","participant_info":{"email":"info@oorhart.be","userId":10497,"lastName":"","firstName":""},"workshop_schedule":{"time":"","end_date":null,"raw_date":"06/06/2025 van 10u00 tot 17u00","start_date":"2025-06-06T09:00:00Z"}}` |
| 6426 | 5/5/2025 | Livia Vande Walle | info@oorhart.be | Voice-overs voor beginners | €0.00 | `{"migration_source":"ID348299_voices.sql","participant_info":{"email":"info@oorhart.be","lastName":"","firstName":""},"workshop_schedule":{"time":"","end_date":null,"raw_date":"06/06/2025 van 10u00 tot 17u00","start_date":"2025-06-06T09:00:00Z"}}` |
| 6426 | 5/5/2025 | Livia Vande Walle | info@oorhart.be | Voice-overs voor beginners | €0.00 | `{"migration_source":"ID348299_voices.sql","participant_info":{"email":"info@oorhart.be","lastName":"","firstName":""},"workshop_schedule":{"time":"","end_date":null,"raw_date":"06/06/2025 van 10u00 tot 17u00","start_date":"2025-06-06T09:00:00Z"}}` |
| 6426 | 5/5/2025 | Livia Vande Walle | info@oorhart.be | Voice-overs voor beginners | €499.00 | `{"migration_source":"ID348299_voices.sql","participant_info":{"age":"22","email":"info@oorhart.be","userId":10497,"lastName":"Vande Walle","firstName":"Livia","experience":"","profession":"Nieuwslezer BRUZZ"},"workshop_schedule":{"time":"","end_date":null,"raw_date":"06/06/2025 van 10u00 tot 17u00","start_date":"2025-06-06T09:00:00Z"}}` |
| 6426 | 5/5/2025 | Livia Vande Walle | info@oorhart.be | Voice-overs voor beginners | €0.00 | `{"migration_source":"ID348299_voices.sql","participant_info":{"email":"info@oorhart.be","lastName":"","firstName":""},"workshop_schedule":{"time":"","end_date":null,"raw_date":"06/06/2025 van 10u00 tot 17u00","start_date":"2025-06-06T09:00:00Z"}}` |
| 6426 | 5/5/2025 | Livia Vande Walle | info@oorhart.be | Voice-overs voor beginners | €0.00 | `{"migration_source":"ID348299_voices.sql","participant_info":{"email":"info@oorhart.be","lastName":"","firstName":""},"workshop_schedule":{"time":"","end_date":null,"raw_date":"06/06/2025 van 10u00 tot 17u00","start_date":"2025-06-06T09:00:00Z"}}` |
| 6424 | 5/5/2025 | Renata Pulings | renata@chapp.one | Voice-overs voor beginners | €499.00 | `{"migration_source":"ID348299_voices.sql","participant_info":{"age":"56","email":"renata@chapp.one","userId":11889,"lastName":"Pulings","firstName":"Renata","experience":"","profession":"zelfstandige"},"workshop_schedule":{"time":"","end_date":null,"raw_date":"06/06/2025 van 10u00 tot 17u00","start_date":"2025-06-06T09:00:00Z"}}` |
| 6424 | 5/5/2025 | Renata Pulings | renata@chapp.one | Voice-overs voor beginners | €0.00 | `{"migration_source":"ID348299_voices.sql","participant_info":{"email":"renata@chapp.one","lastName":"","firstName":""},"workshop_schedule":{"time":"","end_date":null,"raw_date":"06/06/2025 van 10u00 tot 17u00","start_date":"2025-06-06T09:00:00Z"}}` |
| 6424 | 5/5/2025 | Renata Pulings | renata@chapp.one | Voice-overs voor beginners | €0.00 | `{"migration_source":"ID348299_voices.sql","participant_info":{"email":"renata@chapp.one","lastName":"","firstName":""},"workshop_schedule":{"time":"","end_date":null,"raw_date":"06/06/2025 van 10u00 tot 17u00","start_date":"2025-06-06T09:00:00Z"}}` |
| 6424 | 5/5/2025 | Renata Pulings | renata@chapp.one | Voice-overs voor beginners | €0.00 | `{"migration_source":"ID348299_voices.sql","participant_info":{"email":"renata@chapp.one","lastName":"","firstName":""},"workshop_schedule":{"time":"","end_date":null,"raw_date":"06/06/2025 van 10u00 tot 17u00","start_date":"2025-06-06T09:00:00Z"}}` |
| 6424 | 5/5/2025 | Renata Pulings | renata@chapp.one | Voice-overs voor beginners | €0.00 | `{"migration_source":"ID348299_voices.sql","participant_info":{"age":"56","email":"renata@chapp.one","userId":11889,"lastName":"Pulings","firstName":"Renata","experience":"","profession":"zelfstandige"},"workshop_schedule":{"time":"","end_date":null,"raw_date":"06/06/2025 van 10u00 tot 17u00","start_date":"2025-06-06T09:00:00Z"}}` |
| 6424 | 5/5/2025 | Renata Pulings | renata@chapp.one | Voice-overs voor beginners | €0.00 | `{"migration_source":"ID348299_voices.sql","participant_info":{"email":"renata@chapp.one","userId":11889,"lastName":"","firstName":""},"workshop_schedule":{"time":"","end_date":null,"raw_date":"06/06/2025 van 10u00 tot 17u00","start_date":"2025-06-06T09:00:00Z"}}` |
| 6417 | 29/4/2025 | Yves Tits | yves.tits@gmail.com | Voice-overs voor beginners | €0.00 | `{"migration_source":"ID348299_voices.sql","participant_info":{"age":"42","email":"yves.tits@gmail.com","userId":11886,"lastName":"","firstName":"","experience":"","profession":"Personeelsverantwoordelijke jeugdzorg"},"workshop_schedule":{"time":"","end_date":null,"raw_date":"06/06/2025 van 10u00 tot 17u00","start_date":"2025-06-06T09:00:00Z"}}` |
| 6417 | 29/4/2025 | Yves Tits | yves.tits@gmail.com | Voice-overs voor beginners | €0.00 | `{"migration_source":"ID348299_voices.sql","participant_info":{"email":"yves.tits@gmail.com","userId":11886,"lastName":"","firstName":""},"workshop_schedule":{"time":"","end_date":null,"raw_date":"06/06/2025 van 10u00 tot 17u00","start_date":"2025-06-06T09:00:00Z"}}` |
| 6417 | 29/4/2025 | Yves Tits | yves.tits@gmail.com | Voice-overs voor beginners | €0.00 | `{"migration_source":"ID348299_voices.sql","participant_info":{"age":"42","email":"yves.tits@gmail.com","userId":11886,"lastName":"Tits","firstName":"Yves","experience":"","profession":"Personeelsverantwoordelijke jeugdzorg"},"workshop_schedule":{"time":"","end_date":null,"raw_date":"06/06/2025 van 10u00 tot 17u00","start_date":"2025-06-06T09:00:00Z"}}` |
| 6417 | 29/4/2025 | Yves Tits | yves.tits@gmail.com | Voice-overs voor beginners | €0.00 | `{"migration_source":"ID348299_voices.sql","participant_info":{"email":"yves.tits@gmail.com","lastName":"","firstName":""},"workshop_schedule":{"time":"","end_date":null,"raw_date":"06/06/2025 van 10u00 tot 17u00","start_date":"2025-06-06T09:00:00Z"}}` |
| 6417 | 29/4/2025 | Yves Tits | yves.tits@gmail.com | Voice-overs voor beginners | €499.00 | `{"migration_source":"ID348299_voices.sql","participant_info":{"age":"42","email":"yves.tits@gmail.com","userId":11886,"lastName":"Tits","firstName":"Yves","experience":"","profession":"Personeelsverantwoordelijke jeugdzorg"},"workshop_schedule":{"time":"","end_date":null,"raw_date":"06/06/2025 van 10u00 tot 17u00","start_date":"2025-06-06T09:00:00Z"}}` |
| 6417 | 29/4/2025 | Yves Tits | yves.tits@gmail.com | Voice-overs voor beginners | €0.00 | `{"migration_source":"ID348299_voices.sql","participant_info":{"email":"yves.tits@gmail.com","lastName":"","firstName":""},"workshop_schedule":{"time":"","end_date":null,"raw_date":"06/06/2025 van 10u00 tot 17u00","start_date":"2025-06-06T09:00:00Z"}}` |
| 6395 | 14/4/2025 | Gussie Druyts | gussie.druyts@gmail.com | Audioboeken inspreken | €0.00 | `{"migration_source":"ID348299_voices.sql","participant_info":{"email":"gussie.druyts@gmail.com","lastName":"","firstName":""},"workshop_schedule":{"time":"","end_date":null,"raw_date":"02/06/2025 van 10u00 tot 17u00","start_date":"2025-06-02T09:00:00Z"}}` |
